seman@mediagtw:~$ # Terminál 1 na mediagtw — RTP traffic k/od RO Asterisk
sudo tcpdump -i eth0 -n "udp and host 10.33.0.55 and portrange 10000-20000"
tcpdump: verbose output suppressed, use -v[v]... for full protocol decode
listening on eth0, link-type EN10MB (Ethernet), snapshot length 262144 bytes
14:27:54.669226 IP 10.1.2.112.13506 > 10.33.0.55.19722: UDP, length 172
14:27:54.689208 IP 10.1.2.112.13506 > 10.33.0.55.19722: UDP, length 172
14:27:54.709210 IP 10.1.2.112.13506 > 10.33.0.55.19722: UDP, length 172
14:27:54.729210 IP 10.1.2.112.13506 > 10.33.0.55.19722: UDP, length 172
14:27:54.749208 IP 10.1.2.112.13506 > 10.33.0.55.19722: UDP, length 172
14:27:54.769209 IP 10.1.2.112.13506 > 10.33.0.55.19722: UDP, length 172
14:27:54.789211 IP 10.1.2.112.13506 > 10.33.0.55.19722: UDP, length 172
14:27:54.809208 IP 10.1.2.112.13506 > 10.33.0.55.19722: UDP, length 172
14:27:54.829208 IP 10.1.2.112.13506 > 10.33.0.55.19722: UDP, length 172
14:27:54.849206 IP 10.1.2.112.13506 > 10.33.0.55.19722: UDP, length 172
14:27:54.869214 IP 10.1.2.112.13506 > 10.33.0.55.19722: UDP, length 172
14:27:54.889207 IP 10.1.2.112.13506 > 10.33.0.55.19722: UDP, length 172
14:27:54.909260 IP 10.1.2.112.13506 > 10.33.0.55.19722: UDP, length 172
14:27:54.929246 IP 10.1.2.112.13506 > 10.33.0.55.19722: UDP, length 172
14:27:54.949235 IP 10.1.2.112.13506 > 10.33.0.55.19722: UDP, length 172
14:27:54.969212 IP 10.1.2.112.13506 > 10.33.0.55.19722: UDP, length 172
14:27:54.989221 IP 10.1.2.112.13506 > 10.33.0.55.19722: UDP, length 172
14:27:55.009219 IP 10.1.2.112.13506 > 10.33.0.55.19722: UDP, length 172
14:27:55.029209 IP 10.1.2.112.13506 > 10.33.0.55.19722: UDP, length 172
14:27:55.049214 IP 10.1.2.112.13506 > 10.33.0.55.19722: UDP, length 172
14:27:55.069209 IP 10.1.2.112.13506 > 10.33.0.55.19722: UDP, length 172
14:27:55.089211 IP 10.1.2.112.13506 > 10.33.0.55.19722: UDP, length 172
14:27:55.109209 IP 10.1.2.112.13506 > 10.33.0.55.19722: UDP, length 172
14:27:55.129208 IP 10.1.2.112.13506 > 10.33.0.55.19722: UDP, length 172
14:27:55.149209 IP 10.1.2.112.13506 > 10.33.0.55.19722: UDP, length 172
14:27:55.169210 IP 10.1.2.112.13506 > 10.33.0.55.19722: UDP, length 172
14:27:55.189208 IP 10.1.2.112.13506 > 10.33.0.55.19722: UDP, length 172
14:27:55.209213 IP 10.1.2.112.13506 > 10.33.0.55.19722: UDP, length 172
14:27:55.229234 IP 10.1.2.112.13506 > 10.33.0.55.19722: UDP, length 172
14:27:55.249237 IP 10.1.2.112.13506 > 10.33.0.55.19722: UDP, length 172
14:27:55.269222 IP 10.1.2.112.13506 > 10.33.0.55.19722: UDP, length 172
14:27:55.289213 IP 10.1.2.112.13506 > 10.33.0.55.19722: UDP, length 172
14:27:55.309211 IP 10.1.2.112.13506 > 10.33.0.55.19722: UDP, length 172
14:27:55.329208 IP 10.1.2.112.13506 > 10.33.0.55.19722: UDP, length 172
14:27:55.349208 IP 10.1.2.112.13506 > 10.33.0.55.19722: UDP, length 172
14:27:55.369208 IP 10.1.2.112.13506 > 10.33.0.55.19722: UDP, length 172
14:27:55.389207 IP 10.1.2.112.13506 > 10.33.0.55.19722: UDP, length 172
14:27:55.409208 IP 10.1.2.112.13506 > 10.33.0.55.19722: UDP, length 172
14:27:55.429208 IP 10.1.2.112.13506 > 10.33.0.55.19722: UDP, length 172
14:27:55.449209 IP 10.1.2.112.13506 > 10.33.0.55.19722: UDP, length 172
14:27:55.469213 IP 10.1.2.112.13506 > 10.33.0.55.19722: UDP, length 172
14:27:55.489209 IP 10.1.2.112.13506 > 10.33.0.55.19722: UDP, length 172
14:27:55.509207 IP 10.1.2.112.13506 > 10.33.0.55.19722: UDP, length 172
14:27:55.529206 IP 10.1.2.112.13506 > 10.33.0.55.19722: UDP, length 172
14:27:55.549208 IP 10.1.2.112.13506 > 10.33.0.55.19722: UDP, length 172
14:27:55.569230 IP 10.1.2.112.13506 > 10.33.0.55.19722: UDP, length 172
14:27:55.589209 IP 10.1.2.112.13506 > 10.33.0.55.19722: UDP, length 172
14:27:55.609207 IP 10.1.2.112.13506 > 10.33.0.55.19722: UDP, length 172
14:27:55.629209 IP 10.1.2.112.13506 > 10.33.0.55.19722: UDP, length 172
14:27:55.649206 IP 10.1.2.112.13506 > 10.33.0.55.19722: UDP, length 172
14:27:55.669206 IP 10.1.2.112.13506 > 10.33.0.55.19722: UDP, length 172
14:27:55.689206 IP 10.1.2.112.13506 > 10.33.0.55.19722: UDP, length 172
14:27:55.709210 IP 10.1.2.112.13506 > 10.33.0.55.19722: UDP, length 172
14:27:55.729206 IP 10.1.2.112.13506 > 10.33.0.55.19722: UDP, length 172
14:27:55.749208 IP 10.1.2.112.13506 > 10.33.0.55.19722: UDP, length 172
14:27:55.769208 IP 10.1.2.112.13506 > 10.33.0.55.19722: UDP, length 172
14:27:55.789209 IP 10.1.2.112.13506 > 10.33.0.55.19722: UDP, length 172
14:27:55.809206 IP 10.1.2.112.13506 > 10.33.0.55.19722: UDP, length 172
14:27:55.829213 IP 10.1.2.112.13506 > 10.33.0.55.19722: UDP, length 172
14:27:55.849209 IP 10.1.2.112.13506 > 10.33.0.55.19722: UDP, length 172
14:27:55.869208 IP 10.1.2.112.13506 > 10.33.0.55.19722: UDP, length 172
14:27:55.889208 IP 10.1.2.112.13506 > 10.33.0.55.19722: UDP, length 172
14:27:55.909209 IP 10.1.2.112.13506 > 10.33.0.55.19722: UDP, length 172
14:27:55.929208 IP 10.1.2.112.13506 > 10.33.0.55.19722: UDP, length 172
14:27:55.949208 IP 10.1.2.112.13506 > 10.33.0.55.19722: UDP, length 172
14:27:55.969207 IP 10.1.2.112.13506 > 10.33.0.55.19722: UDP, length 172
14:27:55.989254 IP 10.1.2.112.13506 > 10.33.0.55.19722: UDP, length 172
14:27:56.009209 IP 10.1.2.112.13506 > 10.33.0.55.19722: UDP, length 172
14:27:56.029223 IP 10.1.2.112.13506 > 10.33.0.55.19722: UDP, length 172
14:27:56.049211 IP 10.1.2.112.13506 > 10.33.0.55.19722: UDP, length 172
14:27:56.069210 IP 10.1.2.112.13506 > 10.33.0.55.19722: UDP, length 172
14:27:56.089209 IP 10.1.2.112.13506 > 10.33.0.55.19722: UDP, length 172
14:27:56.109208 IP 10.1.2.112.13506 > 10.33.0.55.19722: UDP, length 172
14:27:56.129209 IP 10.1.2.112.13506 > 10.33.0.55.19722: UDP, length 172
14:27:56.149207 IP 10.1.2.112.13506 > 10.33.0.55.19722: UDP, length 172
14:27:56.169206 IP 10.1.2.112.13506 > 10.33.0.55.19722: UDP, length 172
14:27:56.189213 IP 10.1.2.112.13506 > 10.33.0.55.19722: UDP, length 172
14:27:56.200657 IP 10.1.2.112.13506 > 10.33.0.55.19722: UDP, length 172
14:27:56.219257 IP 10.1.2.112.13506 > 10.33.0.55.19722: UDP, length 172
14:27:56.239297 IP 10.1.2.112.13506 > 10.33.0.55.19722: UDP, length 172
14:27:56.259139 IP 10.1.2.112.13506 > 10.33.0.55.19722: UDP, length 172
14:27:56.278938 IP 10.1.2.112.13506 > 10.33.0.55.19722: UDP, length 172
14:27:56.299209 IP 10.1.2.112.13506 > 10.33.0.55.19722: UDP, length 172
14:27:56.319317 IP 10.1.2.112.13506 > 10.33.0.55.19722: UDP, length 172
14:27:56.339169 IP 10.1.2.112.13506 > 10.33.0.55.19722: UDP, length 172
14:27:56.359225 IP 10.1.2.112.13506 > 10.33.0.55.19722: UDP, length 172
14:27:56.378941 IP 10.1.2.112.13506 > 10.33.0.55.19722: UDP, length 172
14:27:56.398913 IP 10.1.2.112.13506 > 10.33.0.55.19722: UDP, length 172
14:27:56.418934 IP 10.1.2.112.13506 > 10.33.0.55.19722: UDP, length 172
14:27:56.439144 IP 10.1.2.112.13506 > 10.33.0.55.19722: UDP, length 172
14:27:56.459160 IP 10.1.2.112.13506 > 10.33.0.55.19722: UDP, length 172
14:27:56.478866 IP 10.1.2.112.13506 > 10.33.0.55.19722: UDP, length 172
14:27:56.499142 IP 10.1.2.112.13506 > 10.33.0.55.19722: UDP, length 172
14:27:56.519171 IP 10.1.2.112.13506 > 10.33.0.55.19722: UDP, length 172
14:27:56.539093 IP 10.1.2.112.13506 > 10.33.0.55.19722: UDP, length 172
14:27:56.559108 IP 10.1.2.112.13506 > 10.33.0.55.19722: UDP, length 172
14:27:56.578966 IP 10.1.2.112.13506 > 10.33.0.55.19722: UDP, length 172
14:27:56.599090 IP 10.1.2.112.13506 > 10.33.0.55.19722: UDP, length 172
14:27:56.619067 IP 10.1.2.112.13506 > 10.33.0.55.19722: UDP, length 172
14:27:56.639145 IP 10.1.2.112.13506 > 10.33.0.55.19722: UDP, length 172
14:27:56.659103 IP 10.1.2.112.13506 > 10.33.0.55.19722: UDP, length 172
14:27:56.679009 IP 10.1.2.112.13506 > 10.33.0.55.19722: UDP, length 172
14:27:56.699070 IP 10.1.2.112.13506 > 10.33.0.55.19722: UDP, length 172
14:27:56.719139 IP 10.1.2.112.13506 > 10.33.0.55.19722: UDP, length 172
14:27:56.739225 IP 10.1.2.112.13506 > 10.33.0.55.19722: UDP, length 172
14:27:56.759083 IP 10.1.2.112.13506 > 10.33.0.55.19722: UDP, length 172
14:27:56.778968 IP 10.1.2.112.13506 > 10.33.0.55.19722: UDP, length 172
14:27:56.798927 IP 10.1.2.112.13506 > 10.33.0.55.19722: UDP, length 172
14:27:56.818693 IP 10.1.2.112.13506 > 10.33.0.55.19722: UDP, length 172
14:27:56.839073 IP 10.1.2.112.13506 > 10.33.0.55.19722: UDP, length 172
14:27:56.859120 IP 10.1.2.112.13506 > 10.33.0.55.19722: UDP, length 172
14:27:56.879159 IP 10.1.2.112.13506 > 10.33.0.55.19722: UDP, length 172
14:27:56.898994 IP 10.1.2.112.13506 > 10.33.0.55.19722: UDP, length 172
14:27:56.918872 IP 10.1.2.112.13506 > 10.33.0.55.19722: UDP, length 172
14:27:56.939240 IP 10.1.2.112.13506 > 10.33.0.55.19722: UDP, length 172
14:27:56.958920 IP 10.1.2.112.13506 > 10.33.0.55.19722: UDP, length 172
14:27:56.979141 IP 10.1.2.112.13506 > 10.33.0.55.19722: UDP, length 172
14:27:56.998936 IP 10.1.2.112.13506 > 10.33.0.55.19722: UDP, length 172
14:27:57.018903 IP 10.1.2.112.13506 > 10.33.0.55.19722: UDP, length 172
14:27:57.039162 IP 10.1.2.112.13506 > 10.33.0.55.19722: UDP, length 172
14:27:57.058994 IP 10.1.2.112.13506 > 10.33.0.55.19722: UDP, length 172
14:27:57.079191 IP 10.1.2.112.13506 > 10.33.0.55.19722: UDP, length 172
14:27:57.099119 IP 10.1.2.112.13506 > 10.33.0.55.19722: UDP, length 172
14:27:57.119130 IP 10.1.2.112.13506 > 10.33.0.55.19722: UDP, length 172
14:27:57.139230 IP 10.1.2.112.13506 > 10.33.0.55.19722: UDP, length 172
14:27:57.158981 IP 10.1.2.112.13506 > 10.33.0.55.19722: UDP, length 172
14:27:57.179194 IP 10.1.2.112.13506 > 10.33.0.55.19722: UDP, length 172
14:27:57.198918 IP 10.1.2.112.13506 > 10.33.0.55.19722: UDP, length 172
14:27:57.218905 IP 10.1.2.112.13506 > 10.33.0.55.19722: UDP, length 172
14:27:57.239141 IP 10.1.2.112.13506 > 10.33.0.55.19722: UDP, length 172
14:27:57.259325 IP 10.1.2.112.13506 > 10.33.0.55.19722: UDP, length 172
14:27:57.279191 IP 10.1.2.112.13506 > 10.33.0.55.19722: UDP, length 172
14:27:57.298985 IP 10.1.2.112.13506 > 10.33.0.55.19722: UDP, length 172
14:27:57.319108 IP 10.1.2.112.13506 > 10.33.0.55.19722: UDP, length 172
14:27:57.339094 IP 10.1.2.112.13506 > 10.33.0.55.19722: UDP, length 172
14:27:57.359074 IP 10.1.2.112.13506 > 10.33.0.55.19722: UDP, length 172
14:27:57.379089 IP 10.1.2.112.13506 > 10.33.0.55.19722: UDP, length 172
14:27:57.398942 IP 10.1.2.112.13506 > 10.33.0.55.19722: UDP, length 172
14:27:57.418929 IP 10.1.2.112.13506 > 10.33.0.55.19722: UDP, length 172
14:27:57.438923 IP 10.1.2.112.13506 > 10.33.0.55.19722: UDP, length 172
14:27:57.459109 IP 10.1.2.112.13506 > 10.33.0.55.19722: UDP, length 172
14:27:57.478907 IP 10.1.2.112.13506 > 10.33.0.55.19722: UDP, length 172
14:27:57.499100 IP 10.1.2.112.13506 > 10.33.0.55.19722: UDP, length 172
14:27:57.518877 IP 10.1.2.112.13506 > 10.33.0.55.19722: UDP, length 172
14:27:57.539165 IP 10.1.2.112.13506 > 10.33.0.55.19722: UDP, length 172
14:27:57.559204 IP 10.1.2.112.13506 > 10.33.0.55.19722: UDP, length 172
14:27:57.579179 IP 10.1.2.112.13506 > 10.33.0.55.19722: UDP, length 172
14:27:57.599304 IP 10.1.2.112.13506 > 10.33.0.55.19722: UDP, length 172
14:27:57.619673 IP 10.1.2.112.13506 > 10.33.0.55.19722: UDP, length 172
14:27:57.639287 IP 10.1.2.112.13506 > 10.33.0.55.19722: UDP, length 172
14:27:57.659246 IP 10.1.2.112.13506 > 10.33.0.55.19722: UDP, length 172
14:27:57.679289 IP 10.1.2.112.13506 > 10.33.0.55.19722: UDP, length 172
14:27:57.699268 IP 10.1.2.112.13506 > 10.33.0.55.19722: UDP, length 172
14:27:57.719304 IP 10.1.2.112.13506 > 10.33.0.55.19722: UDP, length 172
14:27:57.739299 IP 10.1.2.112.13506 > 10.33.0.55.19722: UDP, length 172
14:27:57.759252 IP 10.1.2.112.13506 > 10.33.0.55.19722: UDP, length 172
14:27:57.779007 IP 10.1.2.112.13506 > 10.33.0.55.19722: UDP, length 172
14:27:57.799095 IP 10.1.2.112.13506 > 10.33.0.55.19722: UDP, length 172
14:27:57.818994 IP 10.1.2.112.13506 > 10.33.0.55.19722: UDP, length 172
14:27:57.839075 IP 10.1.2.112.13506 > 10.33.0.55.19722: UDP, length 172
14:27:57.859119 IP 10.1.2.112.13506 > 10.33.0.55.19722: UDP, length 172
14:27:57.879087 IP 10.1.2.112.13506 > 10.33.0.55.19722: UDP, length 172
14:27:57.899145 IP 10.1.2.112.13506 > 10.33.0.55.19722: UDP, length 172
14:27:57.919154 IP 10.1.2.112.13506 > 10.33.0.55.19722: UDP, length 172
14:27:57.939284 IP 10.1.2.112.13506 > 10.33.0.55.19722: UDP, length 172
14:27:57.959126 IP 10.1.2.112.13506 > 10.33.0.55.19722: UDP, length 172
14:27:57.979301 IP 10.1.2.112.13506 > 10.33.0.55.19722: UDP, length 172
14:27:57.999295 IP 10.1.2.112.13506 > 10.33.0.55.19722: UDP, length 172
14:27:58.019292 IP 10.1.2.112.13506 > 10.33.0.55.19722: UDP, length 172
14:27:58.039095 IP 10.1.2.112.13506 > 10.33.0.55.19722: UDP, length 172
14:27:58.059182 IP 10.1.2.112.13506 > 10.33.0.55.19722: UDP, length 172
14:27:58.079269 IP 10.1.2.112.13506 > 10.33.0.55.19722: UDP, length 172
14:27:58.099285 IP 10.1.2.112.13506 > 10.33.0.55.19722: UDP, length 172
14:27:58.119184 IP 10.1.2.112.13506 > 10.33.0.55.19722: UDP, length 172
14:27:58.139307 IP 10.1.2.112.13506 > 10.33.0.55.19722: UDP, length 172
14:27:58.159290 IP 10.1.2.112.13506 > 10.33.0.55.19722: UDP, length 172
14:27:58.179270 IP 10.1.2.112.13506 > 10.33.0.55.19722: UDP, length 172
14:27:58.199115 IP 10.1.2.112.13506 > 10.33.0.55.19722: UDP, length 172
14:27:58.219226 IP 10.1.2.112.13506 > 10.33.0.55.19722: UDP, length 172
14:27:58.239433 IP 10.1.2.112.13506 > 10.33.0.55.19722: UDP, length 172
14:27:58.259246 IP 10.1.2.112.13506 > 10.33.0.55.19722: UDP, length 172
14:27:58.279109 IP 10.1.2.112.13506 > 10.33.0.55.19722: UDP, length 172
14:27:58.299244 IP 10.1.2.112.13506 > 10.33.0.55.19722: UDP, length 172
14:27:58.319225 IP 10.1.2.112.13506 > 10.33.0.55.19722: UDP, length 172
14:27:58.339291 IP 10.1.2.112.13506 > 10.33.0.55.19722: UDP, length 172
14:27:58.359231 IP 10.1.2.112.13506 > 10.33.0.55.19722: UDP, length 172
14:27:58.379179 IP 10.1.2.112.13506 > 10.33.0.55.19722: UDP, length 172
14:27:58.399351 IP 10.1.2.112.13506 > 10.33.0.55.19722: UDP, length 172
14:27:58.419217 IP 10.1.2.112.13506 > 10.33.0.55.19722: UDP, length 172
14:27:58.439226 IP 10.1.2.112.13506 > 10.33.0.55.19722: UDP, length 172
14:27:58.459085 IP 10.1.2.112.13506 > 10.33.0.55.19722: UDP, length 172
14:27:58.479197 IP 10.1.2.112.13506 > 10.33.0.55.19722: UDP, length 172
14:27:58.499243 IP 10.1.2.112.13506 > 10.33.0.55.19722: UDP, length 172
14:27:58.519137 IP 10.1.2.112.13506 > 10.33.0.55.19722: UDP, length 172
14:27:58.539116 IP 10.1.2.112.13506 > 10.33.0.55.19722: UDP, length 172
14:27:58.558866 IP 10.1.2.112.13506 > 10.33.0.55.19722: UDP, length 172
14:27:58.579147 IP 10.1.2.112.13506 > 10.33.0.55.19722: UDP, length 172
14:27:58.599105 IP 10.1.2.112.13506 > 10.33.0.55.19722: UDP, length 172
14:27:58.619299 IP 10.1.2.112.13506 > 10.33.0.55.19722: UDP, length 172
14:27:58.639121 IP 10.1.2.112.13506 > 10.33.0.55.19722: UDP, length 172
14:27:58.659269 IP 10.1.2.112.13506 > 10.33.0.55.19722: UDP, length 172
14:27:58.679166 IP 10.1.2.112.13506 > 10.33.0.55.19722: UDP, length 172
14:27:58.699126 IP 10.1.2.112.13506 > 10.33.0.55.19722: UDP, length 172
14:27:58.719198 IP 10.1.2.112.13506 > 10.33.0.55.19722: UDP, length 172
14:27:58.739175 IP 10.1.2.112.13506 > 10.33.0.55.19722: UDP, length 172
14:27:58.759224 IP 10.1.2.112.13506 > 10.33.0.55.19722: UDP, length 172
14:27:58.779302 IP 10.1.2.112.13506 > 10.33.0.55.19722: UDP, length 172
14:27:58.798977 IP 10.1.2.112.13506 > 10.33.0.55.19722: UDP, length 172
14:27:58.819162 IP 10.1.2.112.13506 > 10.33.0.55.19722: UDP, length 172
14:27:58.839282 IP 10.1.2.112.13506 > 10.33.0.55.19722: UDP, length 172
14:27:58.859304 IP 10.1.2.112.13506 > 10.33.0.55.19722: UDP, length 172
14:27:58.879094 IP 10.1.2.112.13506 > 10.33.0.55.19722: UDP, length 172
14:27:58.899082 IP 10.1.2.112.13506 > 10.33.0.55.19722: UDP, length 172
14:27:58.919168 IP 10.1.2.112.13506 > 10.33.0.55.19722: UDP, length 172
14:27:58.939293 IP 10.1.2.112.13506 > 10.33.0.55.19722: UDP, length 172
14:27:58.959291 IP 10.1.2.112.13506 > 10.33.0.55.19722: UDP, length 172
14:27:58.979308 IP 10.1.2.112.13506 > 10.33.0.55.19722: UDP, length 172
14:27:58.999544 IP 10.1.2.112.13506 > 10.33.0.55.19722: UDP, length 172
14:27:59.019124 IP 10.1.2.112.13506 > 10.33.0.55.19722: UDP, length 172
14:27:59.039326 IP 10.1.2.112.13506 > 10.33.0.55.19722: UDP, length 172
14:27:59.067232 IP 10.1.2.112.13506 > 10.33.0.55.19722: UDP, length 172
14:27:59.079433 IP 10.1.2.112.13506 > 10.33.0.55.19722: UDP, length 172
14:27:59.099347 IP 10.1.2.112.13506 > 10.33.0.55.19722: UDP, length 172
14:27:59.119307 IP 10.1.2.112.13506 > 10.33.0.55.19722: UDP, length 172
14:27:59.139335 IP 10.1.2.112.13506 > 10.33.0.55.19722: UDP, length 172
14:27:59.159802 IP 10.1.2.112.13506 > 10.33.0.55.19722: UDP, length 172
14:27:59.179374 IP 10.1.2.112.13506 > 10.33.0.55.19722: UDP, length 172
14:27:59.199377 IP 10.1.2.112.13506 > 10.33.0.55.19722: UDP, length 172
14:27:59.219372 IP 10.1.2.112.13506 > 10.33.0.55.19722: UDP, length 172
14:27:59.239384 IP 10.1.2.112.13506 > 10.33.0.55.19722: UDP, length 172
14:27:59.259368 IP 10.1.2.112.13506 > 10.33.0.55.19722: UDP, length 172
14:27:59.279254 IP 10.1.2.112.13506 > 10.33.0.55.19722: UDP, length 172
14:27:59.299204 IP 10.1.2.112.13506 > 10.33.0.55.19722: UDP, length 172
14:27:59.319259 IP 10.1.2.112.13506 > 10.33.0.55.19722: UDP, length 172
14:27:59.339366 IP 10.1.2.112.13506 > 10.33.0.55.19722: UDP, length 172
14:27:59.359425 IP 10.1.2.112.13506 > 10.33.0.55.19722: UDP, length 172
14:27:59.379419 IP 10.1.2.112.13506 > 10.33.0.55.19722: UDP, length 172
14:27:59.399292 IP 10.1.2.112.13506 > 10.33.0.55.19722: UDP, length 172
14:27:59.419101 IP 10.1.2.112.13506 > 10.33.0.55.19722: UDP, length 172
14:27:59.439281 IP 10.1.2.112.13506 > 10.33.0.55.19722: UDP, length 172
14:27:59.459671 IP 10.1.2.112.13506 > 10.33.0.55.19722: UDP, length 172
14:27:59.479233 IP 10.1.2.112.13506 > 10.33.0.55.19722: UDP, length 172
14:27:59.499383 IP 10.1.2.112.13506 > 10.33.0.55.19722: UDP, length 172
14:27:59.519229 IP 10.1.2.112.13506 > 10.33.0.55.19722: UDP, length 172
14:27:59.539372 IP 10.1.2.112.13506 > 10.33.0.55.19722: UDP, length 172
14:27:59.559172 IP 10.1.2.112.13506 > 10.33.0.55.19722: UDP, length 172
14:27:59.579315 IP 10.1.2.112.13506 > 10.33.0.55.19722: UDP, length 172
14:27:59.598900 IP 10.1.2.112.13506 > 10.33.0.55.19722: UDP, length 172
14:27:59.619176 IP 10.1.2.112.13506 > 10.33.0.55.19722: UDP, length 172
14:27:59.639400 IP 10.1.2.112.13506 > 10.33.0.55.19722: UDP, length 172
14:27:59.659423 IP 10.1.2.112.13506 > 10.33.0.55.19722: UDP, length 172
14:27:59.668729 IP 10.1.2.112.13507 > 10.33.0.55.19723: UDP, length 76
14:27:59.679246 IP 10.1.2.112.13506 > 10.33.0.55.19722: UDP, length 172
14:27:59.699445 IP 10.1.2.112.13506 > 10.33.0.55.19722: UDP, length 172
14:27:59.719231 IP 10.1.2.112.13506 > 10.33.0.55.19722: UDP, length 172
14:27:59.739201 IP 10.1.2.112.13506 > 10.33.0.55.19722: UDP, length 172
14:27:59.759438 IP 10.1.2.112.13506 > 10.33.0.55.19722: UDP, length 172
14:27:59.779420 IP 10.1.2.112.13506 > 10.33.0.55.19722: UDP, length 172
14:27:59.799436 IP 10.1.2.112.13506 > 10.33.0.55.19722: UDP, length 172
14:27:59.819390 IP 10.1.2.112.13506 > 10.33.0.55.19722: UDP, length 172
14:27:59.839248 IP 10.1.2.112.13506 > 10.33.0.55.19722: UDP, length 172
14:27:59.859441 IP 10.1.2.112.13506 > 10.33.0.55.19722: UDP, length 172
14:27:59.879408 IP 10.1.2.112.13506 > 10.33.0.55.19722: UDP, length 172
14:27:59.899252 IP 10.1.2.112.13506 > 10.33.0.55.19722: UDP, length 172
14:27:59.919178 IP 10.1.2.112.13506 > 10.33.0.55.19722: UDP, length 172
14:27:59.939208 IP 10.1.2.112.13506 > 10.33.0.55.19722: UDP, length 172
14:27:59.959180 IP 10.1.2.112.13506 > 10.33.0.55.19722: UDP, length 172
14:27:59.979312 IP 10.1.2.112.13506 > 10.33.0.55.19722: UDP, length 172
14:27:59.999220 IP 10.1.2.112.13506 > 10.33.0.55.19722: UDP, length 172
14:28:00.019280 IP 10.1.2.112.13506 > 10.33.0.55.19722: UDP, length 172
14:28:00.039370 IP 10.1.2.112.13506 > 10.33.0.55.19722: UDP, length 172
14:28:00.059218 IP 10.1.2.112.13506 > 10.33.0.55.19722: UDP, length 172
14:28:00.079227 IP 10.1.2.112.13506 > 10.33.0.55.19722: UDP, length 172
14:28:00.099248 IP 10.1.2.112.13506 > 10.33.0.55.19722: UDP, length 172
14:28:00.118946 IP 10.1.2.112.13506 > 10.33.0.55.19722: UDP, length 172
14:28:00.139216 IP 10.1.2.112.13506 > 10.33.0.55.19722: UDP, length 172
14:28:00.159277 IP 10.1.2.112.13506 > 10.33.0.55.19722: UDP, length 172
14:28:00.179232 IP 10.1.2.112.13506 > 10.33.0.55.19722: UDP, length 172
14:28:00.199248 IP 10.1.2.112.13506 > 10.33.0.55.19722: UDP, length 172
14:28:00.219294 IP 10.1.2.112.13506 > 10.33.0.55.19722: UDP, length 172
14:28:00.239387 IP 10.1.2.112.13506 > 10.33.0.55.19722: UDP, length 172
14:28:00.259321 IP 10.1.2.112.13506 > 10.33.0.55.19722: UDP, length 172
14:28:00.278948 IP 10.1.2.112.13506 > 10.33.0.55.19722: UDP, length 172
14:28:00.299081 IP 10.1.2.112.13506 > 10.33.0.55.19722: UDP, length 172
14:28:00.319195 IP 10.1.2.112.13506 > 10.33.0.55.19722: UDP, length 172
14:28:00.339445 IP 10.1.2.112.13506 > 10.33.0.55.19722: UDP, length 172
14:28:00.359483 IP 10.1.2.112.13506 > 10.33.0.55.19722: UDP, length 172
14:28:00.379486 IP 10.1.2.112.13506 > 10.33.0.55.19722: UDP, length 172
14:28:00.399494 IP 10.1.2.112.13506 > 10.33.0.55.19722: UDP, length 172
14:28:00.419271 IP 10.1.2.112.13506 > 10.33.0.55.19722: UDP, length 172
14:28:00.439441 IP 10.1.2.112.13506 > 10.33.0.55.19722: UDP, length 172
14:28:00.459390 IP 10.1.2.112.13506 > 10.33.0.55.19722: UDP, length 172
14:28:00.479397 IP 10.1.2.112.13506 > 10.33.0.55.19722: UDP, length 172
14:28:00.499384 IP 10.1.2.112.13506 > 10.33.0.55.19722: UDP, length 172
14:28:00.519124 IP 10.1.2.112.13506 > 10.33.0.55.19722: UDP, length 172
14:28:00.539215 IP 10.1.2.112.13506 > 10.33.0.55.19722: UDP, length 172
14:28:00.559208 IP 10.1.2.112.13506 > 10.33.0.55.19722: UDP, length 172
14:28:00.579398 IP 10.1.2.112.13506 > 10.33.0.55.19722: UDP, length 172
14:28:00.599380 IP 10.1.2.112.13506 > 10.33.0.55.19722: UDP, length 172
14:28:00.619291 IP 10.1.2.112.13506 > 10.33.0.55.19722: UDP, length 172
14:28:00.639034 IP 10.1.2.112.13506 > 10.33.0.55.19722: UDP, length 172
14:28:00.659094 IP 10.1.2.112.13506 > 10.33.0.55.19722: UDP, length 172
14:28:00.679234 IP 10.1.2.112.13506 > 10.33.0.55.19722: UDP, length 172
14:28:00.702557 IP 10.1.2.112.13506 > 10.33.0.55.19722: UDP, length 172
14:28:00.719351 IP 10.1.2.112.13506 > 10.33.0.55.19722: UDP, length 172
14:28:00.739414 IP 10.1.2.112.13506 > 10.33.0.55.19722: UDP, length 172
14:28:00.759565 IP 10.1.2.112.13506 > 10.33.0.55.19722: UDP, length 172
14:28:00.779922 IP 10.1.2.112.13506 > 10.33.0.55.19722: UDP, length 172
14:28:00.799606 IP 10.1.2.112.13506 > 10.33.0.55.19722: UDP, length 172
14:28:00.819281 IP 10.1.2.112.13506 > 10.33.0.55.19722: UDP, length 172
14:28:00.839441 IP 10.1.2.112.13506 > 10.33.0.55.19722: UDP, length 172
14:28:00.860184 IP 10.1.2.112.13506 > 10.33.0.55.19722: UDP, length 172
14:28:00.879415 IP 10.1.2.112.13506 > 10.33.0.55.19722: UDP, length 172
14:28:00.899263 IP 10.1.2.112.13506 > 10.33.0.55.19722: UDP, length 172
14:28:00.919291 IP 10.1.2.112.13506 > 10.33.0.55.19722: UDP, length 172
14:28:00.939388 IP 10.1.2.112.13506 > 10.33.0.55.19722: UDP, length 172
14:28:00.959448 IP 10.1.2.112.13506 > 10.33.0.55.19722: UDP, length 172
14:28:00.979079 IP 10.1.2.112.13506 > 10.33.0.55.19722: UDP, length 172
14:28:00.999376 IP 10.1.2.112.13506 > 10.33.0.55.19722: UDP, length 172
14:28:01.019378 IP 10.1.2.112.13506 > 10.33.0.55.19722: UDP, length 172
14:28:01.039450 IP 10.1.2.112.13506 > 10.33.0.55.19722: UDP, length 172
14:28:01.059214 IP 10.1.2.112.13506 > 10.33.0.55.19722: UDP, length 172
14:28:01.079486 IP 10.1.2.112.13506 > 10.33.0.55.19722: UDP, length 172
14:28:01.099398 IP 10.1.2.112.13506 > 10.33.0.55.19722: UDP, length 172
14:28:01.119063 IP 10.1.2.112.13506 > 10.33.0.55.19722: UDP, length 172
14:28:01.139220 IP 10.1.2.112.13506 > 10.33.0.55.19722: UDP, length 172
14:28:01.159236 IP 10.1.2.112.13506 > 10.33.0.55.19722: UDP, length 172
14:28:01.179413 IP 10.1.2.112.13506 > 10.33.0.55.19722: UDP, length 172
14:28:01.199318 IP 10.1.2.112.13506 > 10.33.0.55.19722: UDP, length 172
14:28:01.219527 IP 10.1.2.112.13506 > 10.33.0.55.19722: UDP, length 172
14:28:01.239414 IP 10.1.2.112.13506 > 10.33.0.55.19722: UDP, length 172
14:28:01.259370 IP 10.1.2.112.13506 > 10.33.0.55.19722: UDP, length 172
14:28:01.279288 IP 10.1.2.112.13506 > 10.33.0.55.19722: UDP, length 172
14:28:01.299206 IP 10.1.2.112.13506 > 10.33.0.55.19722: UDP, length 172
14:28:01.319414 IP 10.1.2.112.13506 > 10.33.0.55.19722: UDP, length 172
14:28:01.339290 IP 10.1.2.112.13506 > 10.33.0.55.19722: UDP, length 172
14:28:01.359357 IP 10.1.2.112.13506 > 10.33.0.55.19722: UDP, length 172
14:28:01.379286 IP 10.1.2.112.13506 > 10.33.0.55.19722: UDP, length 172
14:28:01.399444 IP 10.1.2.112.13506 > 10.33.0.55.19722: UDP, length 172
14:28:01.419237 IP 10.1.2.112.13506 > 10.33.0.55.19722: UDP, length 172
14:28:01.439409 IP 10.1.2.112.13506 > 10.33.0.55.19722: UDP, length 172
14:28:01.459123 IP 10.1.2.112.13506 > 10.33.0.55.19722: UDP, length 172
14:28:01.479428 IP 10.1.2.112.13506 > 10.33.0.55.19722: UDP, length 172
14:28:01.499355 IP 10.1.2.112.13506 > 10.33.0.55.19722: UDP, length 172
14:28:01.519261 IP 10.1.2.112.13506 > 10.33.0.55.19722: UDP, length 172
14:28:01.539227 IP 10.1.2.112.13506 > 10.33.0.55.19722: UDP, length 172
14:28:01.559099 IP 10.1.2.112.13506 > 10.33.0.55.19722: UDP, length 172
14:28:01.579330 IP 10.1.2.112.13506 > 10.33.0.55.19722: UDP, length 172
14:28:01.599180 IP 10.1.2.112.13506 > 10.33.0.55.19722: UDP, length 172
14:28:01.619284 IP 10.1.2.112.13506 > 10.33.0.55.19722: UDP, length 172
14:28:01.639199 IP 10.1.2.112.13506 > 10.33.0.55.19722: UDP, length 172
14:28:01.659134 IP 10.1.2.112.13506 > 10.33.0.55.19722: UDP, length 172
14:28:01.678894 IP 10.1.2.112.13506 > 10.33.0.55.19722: UDP, length 172
14:28:01.699377 IP 10.1.2.112.13506 > 10.33.0.55.19722: UDP, length 172
14:28:01.719230 IP 10.1.2.112.13506 > 10.33.0.55.19722: UDP, length 172
14:28:01.739246 IP 10.1.2.112.13506 > 10.33.0.55.19722: UDP, length 172
14:28:01.759460 IP 10.1.2.112.13506 > 10.33.0.55.19722: UDP, length 172
14:28:01.779424 IP 10.1.2.112.13506 > 10.33.0.55.19722: UDP, length 172
14:28:01.799285 IP 10.1.2.112.13506 > 10.33.0.55.19722: UDP, length 172
14:28:01.819407 IP 10.1.2.112.13506 > 10.33.0.55.19722: UDP, length 172
14:28:01.838878 IP 10.1.2.112.13506 > 10.33.0.55.19722: UDP, length 172
14:28:01.858868 IP 10.1.2.112.13506 > 10.33.0.55.19722: UDP, length 172
14:28:01.879120 IP 10.1.2.112.13506 > 10.33.0.55.19722: UDP, length 172
14:28:01.899266 IP 10.1.2.112.13506 > 10.33.0.55.19722: UDP, length 172
14:28:01.918948 IP 10.1.2.112.13506 > 10.33.0.55.19722: UDP, length 172
14:28:01.939098 IP 10.1.2.112.13506 > 10.33.0.55.19722: UDP, length 172
14:28:01.959057 IP 10.1.2.112.13506 > 10.33.0.55.19722: UDP, length 172
14:28:01.979092 IP 10.1.2.112.13506 > 10.33.0.55.19722: UDP, length 172
14:28:01.999275 IP 10.1.2.112.13506 > 10.33.0.55.19722: UDP, length 172
14:28:02.018808 IP 10.1.2.112.13506 > 10.33.0.55.19722: UDP, length 172
14:28:02.038736 IP 10.1.2.112.13506 > 10.33.0.55.19722: UDP, length 172
14:28:02.058859 IP 10.1.2.112.13506 > 10.33.0.55.19722: UDP, length 172
14:28:02.078819 IP 10.1.2.112.13506 > 10.33.0.55.19722: UDP, length 172
14:28:02.098834 IP 10.1.2.112.13506 > 10.33.0.55.19722: UDP, length 172
14:28:02.118806 IP 10.1.2.112.13506 > 10.33.0.55.19722: UDP, length 172
14:28:02.138821 IP 10.1.2.112.13506 > 10.33.0.55.19722: UDP, length 172
14:28:02.159098 IP 10.1.2.112.13506 > 10.33.0.55.19722: UDP, length 172
14:28:02.179072 IP 10.1.2.112.13506 > 10.33.0.55.19722: UDP, length 172
14:28:02.198784 IP 10.1.2.112.13506 > 10.33.0.55.19722: UDP, length 172
14:28:02.218817 IP 10.1.2.112.13506 > 10.33.0.55.19722: UDP, length 172
14:28:02.238814 IP 10.1.2.112.13506 > 10.33.0.55.19722: UDP, length 172
14:28:02.258883 IP 10.1.2.112.13506 > 10.33.0.55.19722: UDP, length 172
14:28:02.278922 IP 10.1.2.112.13506 > 10.33.0.55.19722: UDP, length 172
14:28:02.299213 IP 10.1.2.112.13506 > 10.33.0.55.19722: UDP, length 172
14:28:02.319185 IP 10.1.2.112.13506 > 10.33.0.55.19722: UDP, length 172
14:28:02.339225 IP 10.1.2.112.13506 > 10.33.0.55.19722: UDP, length 172
14:28:02.359508 IP 10.1.2.112.13506 > 10.33.0.55.19722: UDP, length 172
14:28:02.379137 IP 10.1.2.112.13506 > 10.33.0.55.19722: UDP, length 172
14:28:02.399170 IP 10.1.2.112.13506 > 10.33.0.55.19722: UDP, length 172
14:28:02.419285 IP 10.1.2.112.13506 > 10.33.0.55.19722: UDP, length 172
14:28:02.439004 IP 10.1.2.112.13506 > 10.33.0.55.19722: UDP, length 172
14:28:02.459280 IP 10.1.2.112.13506 > 10.33.0.55.19722: UDP, length 172
14:28:02.479066 IP 10.1.2.112.13506 > 10.33.0.55.19722: UDP, length 172
14:28:02.499222 IP 10.1.2.112.13506 > 10.33.0.55.19722: UDP, length 172
14:28:02.519260 IP 10.1.2.112.13506 > 10.33.0.55.19722: UDP, length 172
14:28:02.539204 IP 10.1.2.112.13506 > 10.33.0.55.19722: UDP, length 172
14:28:02.559088 IP 10.1.2.112.13506 > 10.33.0.55.19722: UDP, length 172
14:28:02.579071 IP 10.1.2.112.13506 > 10.33.0.55.19722: UDP, length 172
14:28:02.599270 IP 10.1.2.112.13506 > 10.33.0.55.19722: UDP, length 172
14:28:02.618942 IP 10.1.2.112.13506 > 10.33.0.55.19722: UDP, length 172
14:28:02.639143 IP 10.1.2.112.13506 > 10.33.0.55.19722: UDP, length 172
14:28:02.659096 IP 10.1.2.112.13506 > 10.33.0.55.19722: UDP, length 172
14:28:02.679124 IP 10.1.2.112.13506 > 10.33.0.55.19722: UDP, length 172
14:28:02.699224 IP 10.1.2.112.13506 > 10.33.0.55.19722: UDP, length 172
14:28:02.718909 IP 10.1.2.112.13506 > 10.33.0.55.19722: UDP, length 172
14:28:02.739186 IP 10.1.2.112.13506 > 10.33.0.55.19722: UDP, length 172
14:28:02.759249 IP 10.1.2.112.13506 > 10.33.0.55.19722: UDP, length 172
14:28:02.779155 IP 10.1.2.112.13506 > 10.33.0.55.19722: UDP, length 172
14:28:02.799257 IP 10.1.2.112.13506 > 10.33.0.55.19722: UDP, length 172
14:28:02.819052 IP 10.1.2.112.13506 > 10.33.0.55.19722: UDP, length 172
14:28:02.839183 IP 10.1.2.112.13506 > 10.33.0.55.19722: UDP, length 172
14:28:02.859258 IP 10.1.2.112.13506 > 10.33.0.55.19722: UDP, length 172
14:28:02.879099 IP 10.1.2.112.13506 > 10.33.0.55.19722: UDP, length 172
14:28:02.899094 IP 10.1.2.112.13506 > 10.33.0.55.19722: UDP, length 172
14:28:02.919234 IP 10.1.2.112.13506 > 10.33.0.55.19722: UDP, length 172
14:28:02.939310 IP 10.1.2.112.13506 > 10.33.0.55.19722: UDP, length 172
14:28:02.959049 IP 10.1.2.112.13506 > 10.33.0.55.19722: UDP, length 172
14:28:02.979227 IP 10.1.2.112.13506 > 10.33.0.55.19722: UDP, length 172
14:28:02.999321 IP 10.1.2.112.13506 > 10.33.0.55.19722: UDP, length 172
14:28:03.019277 IP 10.1.2.112.13506 > 10.33.0.55.19722: UDP, length 172
14:28:03.039206 IP 10.1.2.112.13506 > 10.33.0.55.19722: UDP, length 172
14:28:03.059193 IP 10.1.2.112.13506 > 10.33.0.55.19722: UDP, length 172
14:28:03.079381 IP 10.1.2.112.13506 > 10.33.0.55.19722: UDP, length 172
14:28:03.099170 IP 10.1.2.112.13506 > 10.33.0.55.19722: UDP, length 172
14:28:03.119228 IP 10.1.2.112.13506 > 10.33.0.55.19722: UDP, length 172
14:28:03.139258 IP 10.1.2.112.13506 > 10.33.0.55.19722: UDP, length 172
14:28:03.159464 IP 10.1.2.112.13506 > 10.33.0.55.19722: UDP, length 172
14:28:03.179292 IP 10.1.2.112.13506 > 10.33.0.55.19722: UDP, length 172
14:28:03.199209 IP 10.1.2.112.13506 > 10.33.0.55.19722: UDP, length 172
14:28:03.219424 IP 10.1.2.112.13506 > 10.33.0.55.19722: UDP, length 172
14:28:03.239043 IP 10.1.2.112.13506 > 10.33.0.55.19722: UDP, length 172
14:28:03.259579 IP 10.1.2.112.13506 > 10.33.0.55.19722: UDP, length 172
14:28:03.279398 IP 10.1.2.112.13506 > 10.33.0.55.19722: UDP, length 172
14:28:03.299099 IP 10.1.2.112.13506 > 10.33.0.55.19722: UDP, length 172
14:28:03.319410 IP 10.1.2.112.13506 > 10.33.0.55.19722: UDP, length 172
14:28:03.339413 IP 10.1.2.112.13506 > 10.33.0.55.19722: UDP, length 172
14:28:03.359240 IP 10.1.2.112.13506 > 10.33.0.55.19722: UDP, length 172
14:28:03.379194 IP 10.1.2.112.13506 > 10.33.0.55.19722: UDP, length 172
14:28:03.399433 IP 10.1.2.112.13506 > 10.33.0.55.19722: UDP, length 172
14:28:03.419223 IP 10.1.2.112.13506 > 10.33.0.55.19722: UDP, length 172
14:28:03.439267 IP 10.1.2.112.13506 > 10.33.0.55.19722: UDP, length 172
14:28:03.459379 IP 10.1.2.112.13506 > 10.33.0.55.19722: UDP, length 172
14:28:03.479407 IP 10.1.2.112.13506 > 10.33.0.55.19722: UDP, length 172
14:28:03.499402 IP 10.1.2.112.13506 > 10.33.0.55.19722: UDP, length 172
14:28:03.519353 IP 10.1.2.112.13506 > 10.33.0.55.19722: UDP, length 172
14:28:03.539269 IP 10.1.2.112.13506 > 10.33.0.55.19722: UDP, length 172
14:28:03.559411 IP 10.1.2.112.13506 > 10.33.0.55.19722: UDP, length 172
14:28:03.579398 IP 10.1.2.112.13506 > 10.33.0.55.19722: UDP, length 172
14:28:03.599449 IP 10.1.2.112.13506 > 10.33.0.55.19722: UDP, length 172
14:28:03.619436 IP 10.1.2.112.13506 > 10.33.0.55.19722: UDP, length 172
14:28:03.639209 IP 10.1.2.112.13506 > 10.33.0.55.19722: UDP, length 172
14:28:03.659393 IP 10.1.2.112.13506 > 10.33.0.55.19722: UDP, length 172
14:28:03.679448 IP 10.1.2.112.13506 > 10.33.0.55.19722: UDP, length 172
14:28:03.699743 IP 10.1.2.112.13506 > 10.33.0.55.19722: UDP, length 172
14:28:03.719195 IP 10.1.2.112.13506 > 10.33.0.55.19722: UDP, length 172
14:28:03.739184 IP 10.1.2.112.13506 > 10.33.0.55.19722: UDP, length 172
14:28:03.759009 IP 10.1.2.112.13506 > 10.33.0.55.19722: UDP, length 172
14:28:03.779482 IP 10.1.2.112.13506 > 10.33.0.55.19722: UDP, length 172
14:28:03.799400 IP 10.1.2.112.13506 > 10.33.0.55.19722: UDP, length 172
14:28:03.819330 IP 10.1.2.112.13506 > 10.33.0.55.19722: UDP, length 172
14:28:03.839430 IP 10.1.2.112.13506 > 10.33.0.55.19722: UDP, length 172
14:28:03.859218 IP 10.1.2.112.13506 > 10.33.0.55.19722: UDP, length 172
14:28:03.879368 IP 10.1.2.112.13506 > 10.33.0.55.19722: UDP, length 172
14:28:03.899174 IP 10.1.2.112.13506 > 10.33.0.55.19722: UDP, length 172
14:28:03.919579 IP 10.1.2.112.13506 > 10.33.0.55.19722: UDP, length 172
14:28:03.939222 IP 10.1.2.112.13506 > 10.33.0.55.19722: UDP, length 172
14:28:03.960144 IP 10.1.2.112.13506 > 10.33.0.55.19722: UDP, length 172
14:28:03.979239 IP 10.1.2.112.13506 > 10.33.0.55.19722: UDP, length 172
14:28:03.999272 IP 10.1.2.112.13506 > 10.33.0.55.19722: UDP, length 172
14:28:04.020037 IP 10.1.2.112.13506 > 10.33.0.55.19722: UDP, length 172
14:28:04.039081 IP 10.1.2.112.13506 > 10.33.0.55.19722: UDP, length 172
14:28:04.059194 IP 10.1.2.112.13506 > 10.33.0.55.19722: UDP, length 172
14:28:04.078947 IP 10.1.2.112.13506 > 10.33.0.55.19722: UDP, length 172
14:28:04.099017 IP 10.1.2.112.13506 > 10.33.0.55.19722: UDP, length 172
14:28:04.119039 IP 10.1.2.112.13506 > 10.33.0.55.19722: UDP, length 172
14:28:04.139253 IP 10.1.2.112.13506 > 10.33.0.55.19722: UDP, length 172
14:28:04.159235 IP 10.1.2.112.13506 > 10.33.0.55.19722: UDP, length 172
14:28:04.179408 IP 10.1.2.112.13506 > 10.33.0.55.19722: UDP, length 172
14:28:04.199394 IP 10.1.2.112.13506 > 10.33.0.55.19722: UDP, length 172
14:28:04.219394 IP 10.1.2.112.13506 > 10.33.0.55.19722: UDP, length 172
14:28:04.239370 IP 10.1.2.112.13506 > 10.33.0.55.19722: UDP, length 172
14:28:04.259134 IP 10.1.2.112.13506 > 10.33.0.55.19722: UDP, length 172
14:28:04.278896 IP 10.1.2.112.13506 > 10.33.0.55.19722: UDP, length 172
14:28:04.299364 IP 10.1.2.112.13506 > 10.33.0.55.19722: UDP, length 172
14:28:04.319345 IP 10.1.2.112.13506 > 10.33.0.55.19722: UDP, length 172
14:28:04.339313 IP 10.1.2.112.13506 > 10.33.0.55.19722: UDP, length 172
14:28:04.359188 IP 10.1.2.112.13506 > 10.33.0.55.19722: UDP, length 172
14:28:04.379369 IP 10.1.2.112.13506 > 10.33.0.55.19722: UDP, length 172
14:28:04.399325 IP 10.1.2.112.13506 > 10.33.0.55.19722: UDP, length 172
14:28:04.419361 IP 10.1.2.112.13506 > 10.33.0.55.19722: UDP, length 172
14:28:04.439295 IP 10.1.2.112.13506 > 10.33.0.55.19722: UDP, length 172
14:28:04.459185 IP 10.1.2.112.13506 > 10.33.0.55.19722: UDP, length 172
14:28:04.479087 IP 10.1.2.112.13506 > 10.33.0.55.19722: UDP, length 172
14:28:04.499382 IP 10.1.2.112.13506 > 10.33.0.55.19722: UDP, length 172
14:28:04.519424 IP 10.1.2.112.13506 > 10.33.0.55.19722: UDP, length 172
14:28:04.539371 IP 10.1.2.112.13506 > 10.33.0.55.19722: UDP, length 172
14:28:04.559201 IP 10.1.2.112.13506 > 10.33.0.55.19722: UDP, length 172
14:28:04.579355 IP 10.1.2.112.13506 > 10.33.0.55.19722: UDP, length 172
14:28:04.599417 IP 10.1.2.112.13506 > 10.33.0.55.19722: UDP, length 172
14:28:04.619234 IP 10.1.2.112.13506 > 10.33.0.55.19722: UDP, length 172
14:28:04.639339 IP 10.1.2.112.13506 > 10.33.0.55.19722: UDP, length 172
14:28:04.659366 IP 10.1.2.112.13506 > 10.33.0.55.19722: UDP, length 172
14:28:04.668974 IP 10.1.2.112.13507 > 10.33.0.55.19723: UDP, length 76
14:28:04.679357 IP 10.1.2.112.13506 > 10.33.0.55.19722: UDP, length 172
14:28:04.699309 IP 10.1.2.112.13506 > 10.33.0.55.19722: UDP, length 172
14:28:04.719162 IP 10.1.2.112.13506 > 10.33.0.55.19722: UDP, length 172
14:28:04.739389 IP 10.1.2.112.13506 > 10.33.0.55.19722: UDP, length 172
14:28:04.759135 IP 10.1.2.112.13506 > 10.33.0.55.19722: UDP, length 172
14:28:04.779150 IP 10.1.2.112.13506 > 10.33.0.55.19722: UDP, length 172
14:28:04.798946 IP 10.1.2.112.13506 > 10.33.0.55.19722: UDP, length 172
14:28:04.819305 IP 10.1.2.112.13506 > 10.33.0.55.19722: UDP, length 172
14:28:04.839289 IP 10.1.2.112.13506 > 10.33.0.55.19722: UDP, length 172
14:28:04.859364 IP 10.1.2.112.13506 > 10.33.0.55.19722: UDP, length 172
14:28:04.879127 IP 10.1.2.112.13506 > 10.33.0.55.19722: UDP, length 172
14:28:04.899379 IP 10.1.2.112.13506 > 10.33.0.55.19722: UDP, length 172
14:28:04.919408 IP 10.1.2.112.13506 > 10.33.0.55.19722: UDP, length 172
14:28:04.939410 IP 10.1.2.112.13506 > 10.33.0.55.19722: UDP, length 172
14:28:04.959321 IP 10.1.2.112.13506 > 10.33.0.55.19722: UDP, length 172
14:28:04.979220 IP 10.1.2.112.13506 > 10.33.0.55.19722: UDP, length 172
14:28:04.999350 IP 10.1.2.112.13506 > 10.33.0.55.19722: UDP, length 172
14:28:05.019280 IP 10.1.2.112.13506 > 10.33.0.55.19722: UDP, length 172
14:28:05.039293 IP 10.1.2.112.13506 > 10.33.0.55.19722: UDP, length 172
14:28:05.059197 IP 10.1.2.112.13506 > 10.33.0.55.19722: UDP, length 172
14:28:05.079369 IP 10.1.2.112.13506 > 10.33.0.55.19722: UDP, length 172
14:28:05.099172 IP 10.1.2.112.13506 > 10.33.0.55.19722: UDP, length 172
14:28:05.119450 IP 10.1.2.112.13506 > 10.33.0.55.19722: UDP, length 172
14:28:05.139173 IP 10.1.2.112.13506 > 10.33.0.55.19722: UDP, length 172
14:28:05.159356 IP 10.1.2.112.13506 > 10.33.0.55.19722: UDP, length 172
14:28:05.179410 IP 10.1.2.112.13506 > 10.33.0.55.19722: UDP, length 172
14:28:05.199514 IP 10.1.2.112.13506 > 10.33.0.55.19722: UDP, length 172
14:28:05.219383 IP 10.1.2.112.13506 > 10.33.0.55.19722: UDP, length 172
14:28:05.239339 IP 10.1.2.112.13506 > 10.33.0.55.19722: UDP, length 172
14:28:05.259408 IP 10.1.2.112.13506 > 10.33.0.55.19722: UDP, length 172
14:28:05.279383 IP 10.1.2.112.13506 > 10.33.0.55.19722: UDP, length 172
14:28:05.299372 IP 10.1.2.112.13506 > 10.33.0.55.19722: UDP, length 172
14:28:05.318890 IP 10.1.2.112.13506 > 10.33.0.55.19722: UDP, length 172
14:28:05.339212 IP 10.1.2.112.13506 > 10.33.0.55.19722: UDP, length 172
14:28:05.359372 IP 10.1.2.112.13506 > 10.33.0.55.19722: UDP, length 172
14:28:05.379323 IP 10.1.2.112.13506 > 10.33.0.55.19722: UDP, length 172
14:28:05.399445 IP 10.1.2.112.13506 > 10.33.0.55.19722: UDP, length 172
14:28:05.419319 IP 10.1.2.112.13506 > 10.33.0.55.19722: UDP, length 172
14:28:05.439344 IP 10.1.2.112.13506 > 10.33.0.55.19722: UDP, length 172
14:28:05.459348 IP 10.1.2.112.13506 > 10.33.0.55.19722: UDP, length 172
14:28:05.479193 IP 10.1.2.112.13506 > 10.33.0.55.19722: UDP, length 172
14:28:05.498978 IP 10.1.2.112.13506 > 10.33.0.55.19722: UDP, length 172
14:28:05.519260 IP 10.1.2.112.13506 > 10.33.0.55.19722: UDP, length 172
14:28:05.539408 IP 10.1.2.112.13506 > 10.33.0.55.19722: UDP, length 172
14:28:05.559227 IP 10.1.2.112.13506 > 10.33.0.55.19722: UDP, length 172
14:28:05.579225 IP 10.1.2.112.13506 > 10.33.0.55.19722: UDP, length 172
14:28:05.599253 IP 10.1.2.112.13506 > 10.33.0.55.19722: UDP, length 172
14:28:05.619385 IP 10.1.2.112.13506 > 10.33.0.55.19722: UDP, length 172
14:28:05.639388 IP 10.1.2.112.13506 > 10.33.0.55.19722: UDP, length 172
14:28:05.659342 IP 10.1.2.112.13506 > 10.33.0.55.19722: UDP, length 172
14:28:05.679313 IP 10.1.2.112.13506 > 10.33.0.55.19722: UDP, length 172
14:28:05.699454 IP 10.1.2.112.13506 > 10.33.0.55.19722: UDP, length 172
14:28:05.719125 IP 10.1.2.112.13506 > 10.33.0.55.19722: UDP, length 172
14:28:05.739371 IP 10.1.2.112.13506 > 10.33.0.55.19722: UDP, length 172
14:28:05.759186 IP 10.1.2.112.13506 > 10.33.0.55.19722: UDP, length 172
14:28:05.779246 IP 10.1.2.112.13506 > 10.33.0.55.19722: UDP, length 172
14:28:05.799150 IP 10.1.2.112.13506 > 10.33.0.55.19722: UDP, length 172
14:28:05.819185 IP 10.1.2.112.13506 > 10.33.0.55.19722: UDP, length 172
14:28:05.839146 IP 10.1.2.112.13506 > 10.33.0.55.19722: UDP, length 172
14:28:05.859214 IP 10.1.2.112.13506 > 10.33.0.55.19722: UDP, length 172
14:28:05.879316 IP 10.1.2.112.13506 > 10.33.0.55.19722: UDP, length 172
14:28:05.902200 IP 10.1.2.112.13506 > 10.33.0.55.19722: UDP, length 172
14:28:05.919166 IP 10.1.2.112.13506 > 10.33.0.55.19722: UDP, length 172
14:28:05.939310 IP 10.1.2.112.13506 > 10.33.0.55.19722: UDP, length 172
14:28:05.959266 IP 10.1.2.112.13506 > 10.33.0.55.19722: UDP, length 172
14:28:05.979219 IP 10.1.2.112.13506 > 10.33.0.55.19722: UDP, length 172
14:28:05.999331 IP 10.1.2.112.13506 > 10.33.0.55.19722: UDP, length 172
14:28:06.019178 IP 10.1.2.112.13506 > 10.33.0.55.19722: UDP, length 172
14:28:06.039383 IP 10.1.2.112.13506 > 10.33.0.55.19722: UDP, length 172
14:28:06.059400 IP 10.1.2.112.13506 > 10.33.0.55.19722: UDP, length 172
14:28:06.079339 IP 10.1.2.112.13506 > 10.33.0.55.19722: UDP, length 172
14:28:06.099075 IP 10.1.2.112.13506 > 10.33.0.55.19722: UDP, length 172
14:28:06.119206 IP 10.1.2.112.13506 > 10.33.0.55.19722: UDP, length 172
14:28:06.139213 IP 10.1.2.112.13506 > 10.33.0.55.19722: UDP, length 172
14:28:06.159264 IP 10.1.2.112.13506 > 10.33.0.55.19722: UDP, length 172
14:28:06.178726 IP 10.1.2.112.13506 > 10.33.0.55.19722: UDP, length 172
14:28:06.199219 IP 10.1.2.112.13506 > 10.33.0.55.19722: UDP, length 172
14:28:06.219268 IP 10.1.2.112.13506 > 10.33.0.55.19722: UDP, length 172
14:28:06.239246 IP 10.1.2.112.13506 > 10.33.0.55.19722: UDP, length 172
14:28:06.259253 IP 10.1.2.112.13506 > 10.33.0.55.19722: UDP, length 172
14:28:06.279113 IP 10.1.2.112.13506 > 10.33.0.55.19722: UDP, length 172
14:28:06.299216 IP 10.1.2.112.13506 > 10.33.0.55.19722: UDP, length 172
14:28:06.319059 IP 10.1.2.112.13506 > 10.33.0.55.19722: UDP, length 172
14:28:06.339057 IP 10.1.2.112.13506 > 10.33.0.55.19722: UDP, length 172
14:28:06.358951 IP 10.1.2.112.13506 > 10.33.0.55.19722: UDP, length 172
14:28:06.379245 IP 10.1.2.112.13506 > 10.33.0.55.19722: UDP, length 172
14:28:06.399265 IP 10.1.2.112.13506 > 10.33.0.55.19722: UDP, length 172
14:28:06.419162 IP 10.1.2.112.13506 > 10.33.0.55.19722: UDP, length 172
14:28:06.439132 IP 10.1.2.112.13506 > 10.33.0.55.19722: UDP, length 172
14:28:06.459269 IP 10.1.2.112.13506 > 10.33.0.55.19722: UDP, length 172
14:28:06.478901 IP 10.1.2.112.13506 > 10.33.0.55.19722: UDP, length 172
14:28:06.499101 IP 10.1.2.112.13506 > 10.33.0.55.19722: UDP, length 172
14:28:06.519125 IP 10.1.2.112.13506 > 10.33.0.55.19722: UDP, length 172
14:28:06.539414 IP 10.1.2.112.13506 > 10.33.0.55.19722: UDP, length 172
14:28:06.559454 IP 10.1.2.112.13506 > 10.33.0.55.19722: UDP, length 172
14:28:06.578969 IP 10.1.2.112.13506 > 10.33.0.55.19722: UDP, length 172
14:28:06.599342 IP 10.1.2.112.13506 > 10.33.0.55.19722: UDP, length 172
14:28:06.619199 IP 10.1.2.112.13506 > 10.33.0.55.19722: UDP, length 172
14:28:06.639425 IP 10.1.2.112.13506 > 10.33.0.55.19722: UDP, length 172
14:28:06.659387 IP 10.1.2.112.13506 > 10.33.0.55.19722: UDP, length 172
14:28:06.679389 IP 10.1.2.112.13506 > 10.33.0.55.19722: UDP, length 172
14:28:06.699214 IP 10.1.2.112.13506 > 10.33.0.55.19722: UDP, length 172
14:28:06.719367 IP 10.1.2.112.13506 > 10.33.0.55.19722: UDP, length 172
14:28:06.739565 IP 10.1.2.112.13506 > 10.33.0.55.19722: UDP, length 172
14:28:06.759240 IP 10.1.2.112.13506 > 10.33.0.55.19722: UDP, length 172
14:28:06.779358 IP 10.1.2.112.13506 > 10.33.0.55.19722: UDP, length 172
14:28:06.799318 IP 10.1.2.112.13506 > 10.33.0.55.19722: UDP, length 172
14:28:06.819114 IP 10.1.2.112.13506 > 10.33.0.55.19722: UDP, length 172
14:28:06.839178 IP 10.1.2.112.13506 > 10.33.0.55.19722: UDP, length 172
14:28:06.859367 IP 10.1.2.112.13506 > 10.33.0.55.19722: UDP, length 172
14:28:06.879098 IP 10.1.2.112.13506 > 10.33.0.55.19722: UDP, length 172
14:28:06.899080 IP 10.1.2.112.13506 > 10.33.0.55.19722: UDP, length 172
14:28:06.919161 IP 10.1.2.112.13506 > 10.33.0.55.19722: UDP, length 172
14:28:06.939350 IP 10.1.2.112.13506 > 10.33.0.55.19722: UDP, length 172
14:28:06.959329 IP 10.1.2.112.13506 > 10.33.0.55.19722: UDP, length 172
14:28:06.979335 IP 10.1.2.112.13506 > 10.33.0.55.19722: UDP, length 172
14:28:06.999378 IP 10.1.2.112.13506 > 10.33.0.55.19722: UDP, length 172
14:28:07.019064 IP 10.1.2.112.13506 > 10.33.0.55.19722: UDP, length 172
14:28:07.039407 IP 10.1.2.112.13506 > 10.33.0.55.19722: UDP, length 172
14:28:07.059214 IP 10.1.2.112.13506 > 10.33.0.55.19722: UDP, length 172
14:28:07.079180 IP 10.1.2.112.13506 > 10.33.0.55.19722: UDP, length 172
14:28:07.099161 IP 10.1.2.112.13506 > 10.33.0.55.19722: UDP, length 172
14:28:07.119404 IP 10.1.2.112.13506 > 10.33.0.55.19722: UDP, length 172
14:28:07.139374 IP 10.1.2.112.13506 > 10.33.0.55.19722: UDP, length 172
14:28:07.159382 IP 10.1.2.112.13506 > 10.33.0.55.19722: UDP, length 172
14:28:07.179269 IP 10.1.2.112.13506 > 10.33.0.55.19722: UDP, length 172
14:28:07.199125 IP 10.1.2.112.13506 > 10.33.0.55.19722: UDP, length 172
14:28:07.219149 IP 10.1.2.112.13506 > 10.33.0.55.19722: UDP, length 172
14:28:07.239317 IP 10.1.2.112.13506 > 10.33.0.55.19722: UDP, length 172
14:28:07.259203 IP 10.1.2.112.13506 > 10.33.0.55.19722: UDP, length 172
14:28:07.279239 IP 10.1.2.112.13506 > 10.33.0.55.19722: UDP, length 172
14:28:07.299040 IP 10.1.2.112.13506 > 10.33.0.55.19722: UDP, length 172
14:28:07.319185 IP 10.1.2.112.13506 > 10.33.0.55.19722: UDP, length 172
14:28:07.339429 IP 10.1.2.112.13506 > 10.33.0.55.19722: UDP, length 172
14:28:07.359339 IP 10.1.2.112.13506 > 10.33.0.55.19722: UDP, length 172
14:28:07.379204 IP 10.1.2.112.13506 > 10.33.0.55.19722: UDP, length 172
14:28:07.399107 IP 10.1.2.112.13506 > 10.33.0.55.19722: UDP, length 172
14:28:07.418964 IP 10.1.2.112.13506 > 10.33.0.55.19722: UDP, length 172
14:28:07.439336 IP 10.1.2.112.13506 > 10.33.0.55.19722: UDP, length 172
14:28:07.459192 IP 10.1.2.112.13506 > 10.33.0.55.19722: UDP, length 172
14:28:07.479348 IP 10.1.2.112.13506 > 10.33.0.55.19722: UDP, length 172
14:28:07.499172 IP 10.1.2.112.13506 > 10.33.0.55.19722: UDP, length 172
14:28:07.519070 IP 10.1.2.112.13506 > 10.33.0.55.19722: UDP, length 172
14:28:07.539060 IP 10.1.2.112.13506 > 10.33.0.55.19722: UDP, length 172
14:28:07.559316 IP 10.1.2.112.13506 > 10.33.0.55.19722: UDP, length 172
14:28:07.579421 IP 10.1.2.112.13506 > 10.33.0.55.19722: UDP, length 172
14:28:07.599250 IP 10.1.2.112.13506 > 10.33.0.55.19722: UDP, length 172
14:28:07.619072 IP 10.1.2.112.13506 > 10.33.0.55.19722: UDP, length 172
14:28:07.639090 IP 10.1.2.112.13506 > 10.33.0.55.19722: UDP, length 172
14:28:07.659249 IP 10.1.2.112.13506 > 10.33.0.55.19722: UDP, length 172
14:28:07.679590 IP 10.1.2.112.13506 > 10.33.0.55.19722: UDP, length 172
14:28:07.699263 IP 10.1.2.112.13506 > 10.33.0.55.19722: UDP, length 172
14:28:07.718949 IP 10.1.2.112.13506 > 10.33.0.55.19722: UDP, length 172
14:28:07.739413 IP 10.1.2.112.13506 > 10.33.0.55.19722: UDP, length 172
14:28:07.759218 IP 10.1.2.112.13506 > 10.33.0.55.19722: UDP, length 172
14:28:07.779427 IP 10.1.2.112.13506 > 10.33.0.55.19722: UDP, length 172
14:28:07.799426 IP 10.1.2.112.13506 > 10.33.0.55.19722: UDP, length 172
14:28:07.819225 IP 10.1.2.112.13506 > 10.33.0.55.19722: UDP, length 172
14:28:07.839245 IP 10.1.2.112.13506 > 10.33.0.55.19722: UDP, length 172
14:28:07.859216 IP 10.1.2.112.13506 > 10.33.0.55.19722: UDP, length 172
14:28:07.879196 IP 10.1.2.112.13506 > 10.33.0.55.19722: UDP, length 172
14:28:07.899168 IP 10.1.2.112.13506 > 10.33.0.55.19722: UDP, length 172
14:28:07.919160 IP 10.1.2.112.13506 > 10.33.0.55.19722: UDP, length 172
14:28:07.939182 IP 10.1.2.112.13506 > 10.33.0.55.19722: UDP, length 172
14:28:07.959137 IP 10.1.2.112.13506 > 10.33.0.55.19722: UDP, length 172
14:28:07.979046 IP 10.1.2.112.13506 > 10.33.0.55.19722: UDP, length 172
14:28:07.999021 IP 10.1.2.112.13506 > 10.33.0.55.19722: UDP, length 172
14:28:08.019088 IP 10.1.2.112.13506 > 10.33.0.55.19722: UDP, length 172
14:28:08.039078 IP 10.1.2.112.13506 > 10.33.0.55.19722: UDP, length 172
14:28:08.059077 IP 10.1.2.112.13506 > 10.33.0.55.19722: UDP, length 172
14:28:08.079055 IP 10.1.2.112.13506 > 10.33.0.55.19722: UDP, length 172
14:28:08.099057 IP 10.1.2.112.13506 > 10.33.0.55.19722: UDP, length 172
14:28:08.119073 IP 10.1.2.112.13506 > 10.33.0.55.19722: UDP, length 172
14:28:08.139052 IP 10.1.2.112.13506 > 10.33.0.55.19722: UDP, length 172
14:28:08.159069 IP 10.1.2.112.13506 > 10.33.0.55.19722: UDP, length 172
14:28:08.179020 IP 10.1.2.112.13506 > 10.33.0.55.19722: UDP, length 172
14:28:08.198997 IP 10.1.2.112.13506 > 10.33.0.55.19722: UDP, length 172
14:28:08.219109 IP 10.1.2.112.13506 > 10.33.0.55.19722: UDP, length 172
14:28:08.239191 IP 10.1.2.112.13506 > 10.33.0.55.19722: UDP, length 172
14:28:08.259167 IP 10.1.2.112.13506 > 10.33.0.55.19722: UDP, length 172
14:28:08.279191 IP 10.1.2.112.13506 > 10.33.0.55.19722: UDP, length 172
14:28:08.299370 IP 10.1.2.112.13506 > 10.33.0.55.19722: UDP, length 172
14:28:08.319209 IP 10.1.2.112.13506 > 10.33.0.55.19722: UDP, length 172
14:28:08.339298 IP 10.1.2.112.13506 > 10.33.0.55.19722: UDP, length 172
14:28:08.359414 IP 10.1.2.112.13506 > 10.33.0.55.19722: UDP, length 172
14:28:08.379368 IP 10.1.2.112.13506 > 10.33.0.55.19722: UDP, length 172
14:28:08.399404 IP 10.1.2.112.13506 > 10.33.0.55.19722: UDP, length 172
14:28:08.419380 IP 10.1.2.112.13506 > 10.33.0.55.19722: UDP, length 172
14:28:08.438961 IP 10.1.2.112.13506 > 10.33.0.55.19722: UDP, length 172
14:28:08.459275 IP 10.1.2.112.13506 > 10.33.0.55.19722: UDP, length 172
14:28:08.479184 IP 10.1.2.112.13506 > 10.33.0.55.19722: UDP, length 172
14:28:08.499359 IP 10.1.2.112.13506 > 10.33.0.55.19722: UDP, length 172
14:28:08.520553 IP 10.1.2.112.13506 > 10.33.0.55.19722: UDP, length 172
14:28:08.539195 IP 10.1.2.112.13506 > 10.33.0.55.19722: UDP, length 172
14:28:08.559406 IP 10.1.2.112.13506 > 10.33.0.55.19722: UDP, length 172
14:28:08.579401 IP 10.1.2.112.13506 > 10.33.0.55.19722: UDP, length 172
14:28:08.599162 IP 10.1.2.112.13506 > 10.33.0.55.19722: UDP, length 172
14:28:08.619188 IP 10.1.2.112.13506 > 10.33.0.55.19722: UDP, length 172
14:28:08.639361 IP 10.1.2.112.13506 > 10.33.0.55.19722: UDP, length 172
14:28:08.659375 IP 10.1.2.112.13506 > 10.33.0.55.19722: UDP, length 172
14:28:08.679407 IP 10.1.2.112.13506 > 10.33.0.55.19722: UDP, length 172
14:28:08.699188 IP 10.1.2.112.13506 > 10.33.0.55.19722: UDP, length 172
14:28:08.719214 IP 10.1.2.112.13506 > 10.33.0.55.19722: UDP, length 172
14:28:08.739377 IP 10.1.2.112.13506 > 10.33.0.55.19722: UDP, length 172
14:28:08.759461 IP 10.1.2.112.13506 > 10.33.0.55.19722: UDP, length 172
14:28:08.779410 IP 10.1.2.112.13506 > 10.33.0.55.19722: UDP, length 172
14:28:08.799191 IP 10.1.2.112.13506 > 10.33.0.55.19722: UDP, length 172
14:28:08.819369 IP 10.1.2.112.13506 > 10.33.0.55.19722: UDP, length 172
14:28:08.839357 IP 10.1.2.112.13506 > 10.33.0.55.19722: UDP, length 172
14:28:08.859407 IP 10.1.2.112.13506 > 10.33.0.55.19722: UDP, length 172
14:28:08.879357 IP 10.1.2.112.13506 > 10.33.0.55.19722: UDP, length 172
14:28:08.899359 IP 10.1.2.112.13506 > 10.33.0.55.19722: UDP, length 172
14:28:08.919194 IP 10.1.2.112.13506 > 10.33.0.55.19722: UDP, length 172
14:28:08.939357 IP 10.1.2.112.13506 > 10.33.0.55.19722: UDP, length 172
14:28:08.959351 IP 10.1.2.112.13506 > 10.33.0.55.19722: UDP, length 172
14:28:08.979252 IP 10.1.2.112.13506 > 10.33.0.55.19722: UDP, length 172
14:28:08.999398 IP 10.1.2.112.13506 > 10.33.0.55.19722: UDP, length 172
14:28:09.019006 IP 10.1.2.112.13506 > 10.33.0.55.19722: UDP, length 172
14:28:09.039146 IP 10.1.2.112.13506 > 10.33.0.55.19722: UDP, length 172
14:28:09.059066 IP 10.1.2.112.13506 > 10.33.0.55.19722: UDP, length 172
14:28:09.079394 IP 10.1.2.112.13506 > 10.33.0.55.19722: UDP, length 172
14:28:09.099298 IP 10.1.2.112.13506 > 10.33.0.55.19722: UDP, length 172
14:28:09.119484 IP 10.1.2.112.13506 > 10.33.0.55.19722: UDP, length 172
14:28:09.139248 IP 10.1.2.112.13506 > 10.33.0.55.19722: UDP, length 172
14:28:09.159051 IP 10.1.2.112.13506 > 10.33.0.55.19722: UDP, length 172
14:28:09.179299 IP 10.1.2.112.13506 > 10.33.0.55.19722: UDP, length 172
14:28:09.199269 IP 10.1.2.112.13506 > 10.33.0.55.19722: UDP, length 172
14:28:09.218920 IP 10.1.2.112.13506 > 10.33.0.55.19722: UDP, length 172
14:28:09.239213 IP 10.1.2.112.13506 > 10.33.0.55.19722: UDP, length 172
14:28:09.259320 IP 10.1.2.112.13506 > 10.33.0.55.19722: UDP, length 172
14:28:09.279264 IP 10.1.2.112.13506 > 10.33.0.55.19722: UDP, length 172
14:28:09.299191 IP 10.1.2.112.13506 > 10.33.0.55.19722: UDP, length 172
14:28:09.318945 IP 10.1.2.112.13506 > 10.33.0.55.19722: UDP, length 172
14:28:09.339382 IP 10.1.2.112.13506 > 10.33.0.55.19722: UDP, length 172
14:28:09.359269 IP 10.1.2.112.13506 > 10.33.0.55.19722: UDP, length 172
14:28:09.379071 IP 10.1.2.112.13506 > 10.33.0.55.19722: UDP, length 172
14:28:09.399287 IP 10.1.2.112.13506 > 10.33.0.55.19722: UDP, length 172
14:28:09.419237 IP 10.1.2.112.13506 > 10.33.0.55.19722: UDP, length 172
14:28:09.439120 IP 10.1.2.112.13506 > 10.33.0.55.19722: UDP, length 172
14:28:09.459197 IP 10.1.2.112.13506 > 10.33.0.55.19722: UDP, length 172
14:28:09.478867 IP 10.1.2.112.13506 > 10.33.0.55.19722: UDP, length 172
14:28:09.499326 IP 10.1.2.112.13506 > 10.33.0.55.19722: UDP, length 172
14:28:09.519177 IP 10.1.2.112.13506 > 10.33.0.55.19722: UDP, length 172
14:28:09.539230 IP 10.1.2.112.13506 > 10.33.0.55.19722: UDP, length 172
14:28:09.559235 IP 10.1.2.112.13506 > 10.33.0.55.19722: UDP, length 172
14:28:09.579063 IP 10.1.2.112.13506 > 10.33.0.55.19722: UDP, length 172
14:28:09.600016 IP 10.1.2.112.13506 > 10.33.0.55.19722: UDP, length 172
14:28:09.619334 IP 10.1.2.112.13506 > 10.33.0.55.19722: UDP, length 172
14:28:09.639097 IP 10.1.2.112.13506 > 10.33.0.55.19722: UDP, length 172
14:28:09.659609 IP 10.1.2.112.13506 > 10.33.0.55.19722: UDP, length 172
14:28:09.669201 IP 10.1.2.112.13507 > 10.33.0.55.19723: UDP, length 76
14:28:09.679083 IP 10.1.2.112.13506 > 10.33.0.55.19722: UDP, length 172
14:28:09.699230 IP 10.1.2.112.13506 > 10.33.0.55.19722: UDP, length 172
14:28:09.719071 IP 10.1.2.112.13506 > 10.33.0.55.19722: UDP, length 172
14:28:09.739087 IP 10.1.2.112.13506 > 10.33.0.55.19722: UDP, length 172
14:28:09.759067 IP 10.1.2.112.13506 > 10.33.0.55.19722: UDP, length 172
14:28:09.779091 IP 10.1.2.112.13506 > 10.33.0.55.19722: UDP, length 172
14:28:09.799266 IP 10.1.2.112.13506 > 10.33.0.55.19722: UDP, length 172
14:28:09.819295 IP 10.1.2.112.13506 > 10.33.0.55.19722: UDP, length 172
14:28:09.839191 IP 10.1.2.112.13506 > 10.33.0.55.19722: UDP, length 172
14:28:09.859273 IP 10.1.2.112.13506 > 10.33.0.55.19722: UDP, length 172
14:28:09.879112 IP 10.1.2.112.13506 > 10.33.0.55.19722: UDP, length 172
14:28:09.899222 IP 10.1.2.112.13506 > 10.33.0.55.19722: UDP, length 172
14:28:09.919064 IP 10.1.2.112.13506 > 10.33.0.55.19722: UDP, length 172
14:28:09.939063 IP 10.1.2.112.13506 > 10.33.0.55.19722: UDP, length 172
14:28:09.959290 IP 10.1.2.112.13506 > 10.33.0.55.19722: UDP, length 172
14:28:09.979234 IP 10.1.2.112.13506 > 10.33.0.55.19722: UDP, length 172
14:28:09.999057 IP 10.1.2.112.13506 > 10.33.0.55.19722: UDP, length 172
14:28:10.019229 IP 10.1.2.112.13506 > 10.33.0.55.19722: UDP, length 172
14:28:10.038859 IP 10.1.2.112.13506 > 10.33.0.55.19722: UDP, length 172
14:28:10.059268 IP 10.1.2.112.13506 > 10.33.0.55.19722: UDP, length 172
14:28:10.079268 IP 10.1.2.112.13506 > 10.33.0.55.19722: UDP, length 172
14:28:10.099270 IP 10.1.2.112.13506 > 10.33.0.55.19722: UDP, length 172
14:28:10.119203 IP 10.1.2.112.13506 > 10.33.0.55.19722: UDP, length 172
14:28:10.139069 IP 10.1.2.112.13506 > 10.33.0.55.19722: UDP, length 172
14:28:10.159239 IP 10.1.2.112.13506 > 10.33.0.55.19722: UDP, length 172
14:28:10.179256 IP 10.1.2.112.13506 > 10.33.0.55.19722: UDP, length 172
14:28:10.199247 IP 10.1.2.112.13506 > 10.33.0.55.19722: UDP, length 172
14:28:10.219258 IP 10.1.2.112.13506 > 10.33.0.55.19722: UDP, length 172
14:28:10.239214 IP 10.1.2.112.13506 > 10.33.0.55.19722: UDP, length 172
14:28:10.259220 IP 10.1.2.112.13506 > 10.33.0.55.19722: UDP, length 172
14:28:10.278901 IP 10.1.2.112.13506 > 10.33.0.55.19722: UDP, length 172
14:28:10.298894 IP 10.1.2.112.13506 > 10.33.0.55.19722: UDP, length 172
14:28:10.319200 IP 10.1.2.112.13506 > 10.33.0.55.19722: UDP, length 172
14:28:10.339179 IP 10.1.2.112.13506 > 10.33.0.55.19722: UDP, length 172
14:28:10.359270 IP 10.1.2.112.13506 > 10.33.0.55.19722: UDP, length 172
14:28:10.379380 IP 10.1.2.112.13506 > 10.33.0.55.19722: UDP, length 172
14:28:10.399411 IP 10.1.2.112.13506 > 10.33.0.55.19722: UDP, length 172
14:28:10.419370 IP 10.1.2.112.13506 > 10.33.0.55.19722: UDP, length 172
14:28:10.439272 IP 10.1.2.112.13506 > 10.33.0.55.19722: UDP, length 172
14:28:10.459352 IP 10.1.2.112.13506 > 10.33.0.55.19722: UDP, length 172
14:28:10.479423 IP 10.1.2.112.13506 > 10.33.0.55.19722: UDP, length 172
14:28:10.499401 IP 10.1.2.112.13506 > 10.33.0.55.19722: UDP, length 172
14:28:10.519419 IP 10.1.2.112.13506 > 10.33.0.55.19722: UDP, length 172
14:28:10.539166 IP 10.1.2.112.13506 > 10.33.0.55.19722: UDP, length 172
14:28:10.559141 IP 10.1.2.112.13506 > 10.33.0.55.19722: UDP, length 172
14:28:10.579368 IP 10.1.2.112.13506 > 10.33.0.55.19722: UDP, length 172
14:28:10.599292 IP 10.1.2.112.13506 > 10.33.0.55.19722: UDP, length 172
14:28:10.619193 IP 10.1.2.112.13506 > 10.33.0.55.19722: UDP, length 172
14:28:10.639164 IP 10.1.2.112.13506 > 10.33.0.55.19722: UDP, length 172
14:28:10.659244 IP 10.1.2.112.13506 > 10.33.0.55.19722: UDP, length 172
14:28:10.679530 IP 10.1.2.112.13506 > 10.33.0.55.19722: UDP, length 172
14:28:10.702330 IP 10.1.2.112.13506 > 10.33.0.55.19722: UDP, length 172
14:28:10.719400 IP 10.1.2.112.13506 > 10.33.0.55.19722: UDP, length 172
14:28:10.739322 IP 10.1.2.112.13506 > 10.33.0.55.19722: UDP, length 172
14:28:10.759247 IP 10.1.2.112.13506 > 10.33.0.55.19722: UDP, length 172
14:28:10.779356 IP 10.1.2.112.13506 > 10.33.0.55.19722: UDP, length 172
14:28:10.799361 IP 10.1.2.112.13506 > 10.33.0.55.19722: UDP, length 172
14:28:10.819379 IP 10.1.2.112.13506 > 10.33.0.55.19722: UDP, length 172
14:28:10.839376 IP 10.1.2.112.13506 > 10.33.0.55.19722: UDP, length 172
14:28:10.859160 IP 10.1.2.112.13506 > 10.33.0.55.19722: UDP, length 172
14:28:10.879823 IP 10.1.2.112.13506 > 10.33.0.55.19722: UDP, length 172
14:28:10.899592 IP 10.1.2.112.13506 > 10.33.0.55.19722: UDP, length 172
14:28:10.919353 IP 10.1.2.112.13506 > 10.33.0.55.19722: UDP, length 172
14:28:10.939197 IP 10.1.2.112.13506 > 10.33.0.55.19722: UDP, length 172
14:28:10.959390 IP 10.1.2.112.13506 > 10.33.0.55.19722: UDP, length 172
14:28:10.979403 IP 10.1.2.112.13506 > 10.33.0.55.19722: UDP, length 172
14:28:10.999276 IP 10.1.2.112.13506 > 10.33.0.55.19722: UDP, length 172
14:28:11.019405 IP 10.1.2.112.13506 > 10.33.0.55.19722: UDP, length 172
14:28:11.038894 IP 10.1.2.112.13506 > 10.33.0.55.19722: UDP, length 172
14:28:11.059435 IP 10.1.2.112.13506 > 10.33.0.55.19722: UDP, length 172
14:28:11.079356 IP 10.1.2.112.13506 > 10.33.0.55.19722: UDP, length 172
14:28:11.099321 IP 10.1.2.112.13506 > 10.33.0.55.19722: UDP, length 172
14:28:11.119232 IP 10.1.2.112.13506 > 10.33.0.55.19722: UDP, length 172
14:28:11.139443 IP 10.1.2.112.13506 > 10.33.0.55.19722: UDP, length 172
14:28:11.159400 IP 10.1.2.112.13506 > 10.33.0.55.19722: UDP, length 172
14:28:11.179361 IP 10.1.2.112.13506 > 10.33.0.55.19722: UDP, length 172
14:28:11.199413 IP 10.1.2.112.13506 > 10.33.0.55.19722: UDP, length 172
14:28:11.219423 IP 10.1.2.112.13506 > 10.33.0.55.19722: UDP, length 172
14:28:11.239413 IP 10.1.2.112.13506 > 10.33.0.55.19722: UDP, length 172
14:28:11.259405 IP 10.1.2.112.13506 > 10.33.0.55.19722: UDP, length 172
14:28:11.279261 IP 10.1.2.112.13506 > 10.33.0.55.19722: UDP, length 172
14:28:11.299269 IP 10.1.2.112.13506 > 10.33.0.55.19722: UDP, length 172
14:28:11.319133 IP 10.1.2.112.13506 > 10.33.0.55.19722: UDP, length 172
14:28:11.339105 IP 10.1.2.112.13506 > 10.33.0.55.19722: UDP, length 172
14:28:11.359173 IP 10.1.2.112.13506 > 10.33.0.55.19722: UDP, length 172
14:28:11.379185 IP 10.1.2.112.13506 > 10.33.0.55.19722: UDP, length 172
14:28:11.399167 IP 10.1.2.112.13506 > 10.33.0.55.19722: UDP, length 172
14:28:11.419340 IP 10.1.2.112.13506 > 10.33.0.55.19722: UDP, length 172
14:28:11.439301 IP 10.1.2.112.13506 > 10.33.0.55.19722: UDP, length 172
14:28:11.459401 IP 10.1.2.112.13506 > 10.33.0.55.19722: UDP, length 172
14:28:11.479285 IP 10.1.2.112.13506 > 10.33.0.55.19722: UDP, length 172
14:28:11.498980 IP 10.1.2.112.13506 > 10.33.0.55.19722: UDP, length 172
14:28:11.519239 IP 10.1.2.112.13506 > 10.33.0.55.19722: UDP, length 172
14:28:11.539465 IP 10.1.2.112.13506 > 10.33.0.55.19722: UDP, length 172
14:28:11.559096 IP 10.1.2.112.13506 > 10.33.0.55.19722: UDP, length 172
14:28:11.579395 IP 10.1.2.112.13506 > 10.33.0.55.19722: UDP, length 172
14:28:11.599254 IP 10.1.2.112.13506 > 10.33.0.55.19722: UDP, length 172
14:28:11.619426 IP 10.1.2.112.13506 > 10.33.0.55.19722: UDP, length 172
14:28:11.639189 IP 10.1.2.112.13506 > 10.33.0.55.19722: UDP, length 172
14:28:11.659159 IP 10.1.2.112.13506 > 10.33.0.55.19722: UDP, length 172
14:28:11.679224 IP 10.1.2.112.13506 > 10.33.0.55.19722: UDP, length 172
14:28:11.699207 IP 10.1.2.112.13506 > 10.33.0.55.19722: UDP, length 172
14:28:11.719233 IP 10.1.2.112.13506 > 10.33.0.55.19722: UDP, length 172
14:28:11.739572 IP 10.1.2.112.13506 > 10.33.0.55.19722: UDP, length 172
14:28:11.759227 IP 10.1.2.112.13506 > 10.33.0.55.19722: UDP, length 172
14:28:11.779425 IP 10.1.2.112.13506 > 10.33.0.55.19722: UDP, length 172
14:28:11.799299 IP 10.1.2.112.13506 > 10.33.0.55.19722: UDP, length 172
14:28:11.819179 IP 10.1.2.112.13506 > 10.33.0.55.19722: UDP, length 172
14:28:11.839381 IP 10.1.2.112.13506 > 10.33.0.55.19722: UDP, length 172
14:28:11.859215 IP 10.1.2.112.13506 > 10.33.0.55.19722: UDP, length 172
14:28:11.879416 IP 10.1.2.112.13506 > 10.33.0.55.19722: UDP, length 172
14:28:11.899276 IP 10.1.2.112.13506 > 10.33.0.55.19722: UDP, length 172
14:28:11.919369 IP 10.1.2.112.13506 > 10.33.0.55.19722: UDP, length 172
14:28:11.939366 IP 10.1.2.112.13506 > 10.33.0.55.19722: UDP, length 172
14:28:11.959232 IP 10.1.2.112.13506 > 10.33.0.55.19722: UDP, length 172
14:28:11.979318 IP 10.1.2.112.13506 > 10.33.0.55.19722: UDP, length 172
14:28:11.999402 IP 10.1.2.112.13506 > 10.33.0.55.19722: UDP, length 172
14:28:12.019052 IP 10.1.2.112.13506 > 10.33.0.55.19722: UDP, length 172
14:28:12.039247 IP 10.1.2.112.13506 > 10.33.0.55.19722: UDP, length 172
14:28:12.059312 IP 10.1.2.112.13506 > 10.33.0.55.19722: UDP, length 172
14:28:12.079255 IP 10.1.2.112.13506 > 10.33.0.55.19722: UDP, length 172
14:28:12.099111 IP 10.1.2.112.13506 > 10.33.0.55.19722: UDP, length 172
14:28:12.119164 IP 10.1.2.112.13506 > 10.33.0.55.19722: UDP, length 172
14:28:12.139425 IP 10.1.2.112.13506 > 10.33.0.55.19722: UDP, length 172
14:28:12.159398 IP 10.1.2.112.13506 > 10.33.0.55.19722: UDP, length 172
14:28:12.179368 IP 10.1.2.112.13506 > 10.33.0.55.19722: UDP, length 172
14:28:12.199433 IP 10.1.2.112.13506 > 10.33.0.55.19722: UDP, length 172
14:28:12.219402 IP 10.1.2.112.13506 > 10.33.0.55.19722: UDP, length 172
14:28:12.239382 IP 10.1.2.112.13506 > 10.33.0.55.19722: UDP, length 172
14:28:12.259396 IP 10.1.2.112.13506 > 10.33.0.55.19722: UDP, length 172
14:28:12.279398 IP 10.1.2.112.13506 > 10.33.0.55.19722: UDP, length 172
14:28:12.299289 IP 10.1.2.112.13506 > 10.33.0.55.19722: UDP, length 172
14:28:12.319230 IP 10.1.2.112.13506 > 10.33.0.55.19722: UDP, length 172
14:28:12.339160 IP 10.1.2.112.13506 > 10.33.0.55.19722: UDP, length 172
14:28:12.359159 IP 10.1.2.112.13506 > 10.33.0.55.19722: UDP, length 172
14:28:12.379135 IP 10.1.2.112.13506 > 10.33.0.55.19722: UDP, length 172
14:28:12.399382 IP 10.1.2.112.13506 > 10.33.0.55.19722: UDP, length 172
14:28:12.419212 IP 10.1.2.112.13506 > 10.33.0.55.19722: UDP, length 172
14:28:12.439167 IP 10.1.2.112.13506 > 10.33.0.55.19722: UDP, length 172
14:28:12.459390 IP 10.1.2.112.13506 > 10.33.0.55.19722: UDP, length 172
14:28:12.479796 IP 10.1.2.112.13506 > 10.33.0.55.19722: UDP, length 172
14:28:12.499398 IP 10.1.2.112.13506 > 10.33.0.55.19722: UDP, length 172
14:28:12.519447 IP 10.1.2.112.13506 > 10.33.0.55.19722: UDP, length 172
14:28:12.539281 IP 10.1.2.112.13506 > 10.33.0.55.19722: UDP, length 172
14:28:12.559409 IP 10.1.2.112.13506 > 10.33.0.55.19722: UDP, length 172
14:28:12.579426 IP 10.1.2.112.13506 > 10.33.0.55.19722: UDP, length 172
14:28:12.599169 IP 10.1.2.112.13506 > 10.33.0.55.19722: UDP, length 172
14:28:12.619445 IP 10.1.2.112.13506 > 10.33.0.55.19722: UDP, length 172
14:28:12.639441 IP 10.1.2.112.13506 > 10.33.0.55.19722: UDP, length 172
14:28:12.659402 IP 10.1.2.112.13506 > 10.33.0.55.19722: UDP, length 172
14:28:12.679232 IP 10.1.2.112.13506 > 10.33.0.55.19722: UDP, length 172
14:28:12.699337 IP 10.1.2.112.13506 > 10.33.0.55.19722: UDP, length 172
14:28:12.719198 IP 10.1.2.112.13506 > 10.33.0.55.19722: UDP, length 172
14:28:12.738939 IP 10.1.2.112.13506 > 10.33.0.55.19722: UDP, length 172
14:28:12.759300 IP 10.1.2.112.13506 > 10.33.0.55.19722: UDP, length 172
14:28:12.779476 IP 10.1.2.112.13506 > 10.33.0.55.19722: UDP, length 172
14:28:12.799370 IP 10.1.2.112.13506 > 10.33.0.55.19722: UDP, length 172
14:28:12.819235 IP 10.1.2.112.13506 > 10.33.0.55.19722: UDP, length 172
14:28:12.839407 IP 10.1.2.112.13506 > 10.33.0.55.19722: UDP, length 172
14:28:12.859384 IP 10.1.2.112.13506 > 10.33.0.55.19722: UDP, length 172
14:28:12.879173 IP 10.1.2.112.13506 > 10.33.0.55.19722: UDP, length 172
14:28:12.899402 IP 10.1.2.112.13506 > 10.33.0.55.19722: UDP, length 172
14:28:12.919036 IP 10.1.2.112.13506 > 10.33.0.55.19722: UDP, length 172
14:28:12.939330 IP 10.1.2.112.13506 > 10.33.0.55.19722: UDP, length 172
14:28:12.959297 IP 10.1.2.112.13506 > 10.33.0.55.19722: UDP, length 172
14:28:12.979387 IP 10.1.2.112.13506 > 10.33.0.55.19722: UDP, length 172
14:28:12.999382 IP 10.1.2.112.13506 > 10.33.0.55.19722: UDP, length 172
14:28:13.019407 IP 10.1.2.112.13506 > 10.33.0.55.19722: UDP, length 172
14:28:13.039406 IP 10.1.2.112.13506 > 10.33.0.55.19722: UDP, length 172
14:28:13.059419 IP 10.1.2.112.13506 > 10.33.0.55.19722: UDP, length 172
14:28:13.079372 IP 10.1.2.112.13506 > 10.33.0.55.19722: UDP, length 172
14:28:13.099221 IP 10.1.2.112.13506 > 10.33.0.55.19722: UDP, length 172
14:28:13.119003 IP 10.1.2.112.13506 > 10.33.0.55.19722: UDP, length 172
14:28:13.139399 IP 10.1.2.112.13506 > 10.33.0.55.19722: UDP, length 172
14:28:13.159398 IP 10.1.2.112.13506 > 10.33.0.55.19722: UDP, length 172
14:28:13.179374 IP 10.1.2.112.13506 > 10.33.0.55.19722: UDP, length 172
14:28:13.199330 IP 10.1.2.112.13506 > 10.33.0.55.19722: UDP, length 172
14:28:13.219196 IP 10.1.2.112.13506 > 10.33.0.55.19722: UDP, length 172
14:28:13.239373 IP 10.1.2.112.13506 > 10.33.0.55.19722: UDP, length 172
14:28:13.259363 IP 10.1.2.112.13506 > 10.33.0.55.19722: UDP, length 172
14:28:13.279391 IP 10.1.2.112.13506 > 10.33.0.55.19722: UDP, length 172
14:28:13.299382 IP 10.1.2.112.13506 > 10.33.0.55.19722: UDP, length 172
14:28:13.319403 IP 10.1.2.112.13506 > 10.33.0.55.19722: UDP, length 172
14:28:13.339350 IP 10.1.2.112.13506 > 10.33.0.55.19722: UDP, length 172
14:28:13.359262 IP 10.1.2.112.13506 > 10.33.0.55.19722: UDP, length 172
14:28:13.379074 IP 10.1.2.112.13506 > 10.33.0.55.19722: UDP, length 172
14:28:13.399414 IP 10.1.2.112.13506 > 10.33.0.55.19722: UDP, length 172
14:28:13.419409 IP 10.1.2.112.13506 > 10.33.0.55.19722: UDP, length 172
14:28:13.439381 IP 10.1.2.112.13506 > 10.33.0.55.19722: UDP, length 172
14:28:13.459188 IP 10.1.2.112.13506 > 10.33.0.55.19722: UDP, length 172
14:28:13.479208 IP 10.1.2.112.13506 > 10.33.0.55.19722: UDP, length 172
14:28:13.499154 IP 10.1.2.112.13506 > 10.33.0.55.19722: UDP, length 172
14:28:13.519341 IP 10.1.2.112.13506 > 10.33.0.55.19722: UDP, length 172
14:28:13.539338 IP 10.1.2.112.13506 > 10.33.0.55.19722: UDP, length 172
14:28:13.559239 IP 10.1.2.112.13506 > 10.33.0.55.19722: UDP, length 172
14:28:13.579287 IP 10.1.2.112.13506 > 10.33.0.55.19722: UDP, length 172
14:28:13.599189 IP 10.1.2.112.13506 > 10.33.0.55.19722: UDP, length 172
14:28:13.619233 IP 10.1.2.112.13506 > 10.33.0.55.19722: UDP, length 172
14:28:13.639134 IP 10.1.2.112.13506 > 10.33.0.55.19722: UDP, length 172
14:28:13.659324 IP 10.1.2.112.13506 > 10.33.0.55.19722: UDP, length 172
14:28:13.679224 IP 10.1.2.112.13506 > 10.33.0.55.19722: UDP, length 172
14:28:13.699299 IP 10.1.2.112.13506 > 10.33.0.55.19722: UDP, length 172
14:28:13.719212 IP 10.1.2.112.13506 > 10.33.0.55.19722: UDP, length 172
14:28:13.739220 IP 10.1.2.112.13506 > 10.33.0.55.19722: UDP, length 172
14:28:13.759219 IP 10.1.2.112.13506 > 10.33.0.55.19722: UDP, length 172
14:28:13.779220 IP 10.1.2.112.13506 > 10.33.0.55.19722: UDP, length 172
14:28:13.799079 IP 10.1.2.112.13506 > 10.33.0.55.19722: UDP, length 172
14:28:13.819078 IP 10.1.2.112.13506 > 10.33.0.55.19722: UDP, length 172
14:28:13.839080 IP 10.1.2.112.13506 > 10.33.0.55.19722: UDP, length 172
14:28:13.859074 IP 10.1.2.112.13506 > 10.33.0.55.19722: UDP, length 172
14:28:13.879062 IP 10.1.2.112.13506 > 10.33.0.55.19722: UDP, length 172
14:28:13.899063 IP 10.1.2.112.13506 > 10.33.0.55.19722: UDP, length 172
14:28:13.919216 IP 10.1.2.112.13506 > 10.33.0.55.19722: UDP, length 172
14:28:13.939162 IP 10.1.2.112.13506 > 10.33.0.55.19722: UDP, length 172
14:28:13.959136 IP 10.1.2.112.13506 > 10.33.0.55.19722: UDP, length 172
14:28:13.979339 IP 10.1.2.112.13506 > 10.33.0.55.19722: UDP, length 172
14:28:13.999398 IP 10.1.2.112.13506 > 10.33.0.55.19722: UDP, length 172
14:28:14.019064 IP 10.1.2.112.13506 > 10.33.0.55.19722: UDP, length 172
14:28:14.039403 IP 10.1.2.112.13506 > 10.33.0.55.19722: UDP, length 172
14:28:14.059304 IP 10.1.2.112.13506 > 10.33.0.55.19722: UDP, length 172
14:28:14.079442 IP 10.1.2.112.13506 > 10.33.0.55.19722: UDP, length 172
14:28:14.099385 IP 10.1.2.112.13506 > 10.33.0.55.19722: UDP, length 172
14:28:14.119232 IP 10.1.2.112.13506 > 10.33.0.55.19722: UDP, length 172
14:28:14.139446 IP 10.1.2.112.13506 > 10.33.0.55.19722: UDP, length 172
14:28:14.159411 IP 10.1.2.112.13506 > 10.33.0.55.19722: UDP, length 172
14:28:14.179384 IP 10.1.2.112.13506 > 10.33.0.55.19722: UDP, length 172
14:28:14.199368 IP 10.1.2.112.13506 > 10.33.0.55.19722: UDP, length 172
14:28:14.219207 IP 10.1.2.112.13506 > 10.33.0.55.19722: UDP, length 172
14:28:14.239389 IP 10.1.2.112.13506 > 10.33.0.55.19722: UDP, length 172
14:28:14.259989 IP 10.1.2.112.13506 > 10.33.0.55.19722: UDP, length 172
14:28:14.279398 IP 10.1.2.112.13506 > 10.33.0.55.19722: UDP, length 172
14:28:14.299046 IP 10.1.2.112.13506 > 10.33.0.55.19722: UDP, length 172
14:28:14.319036 IP 10.1.2.112.13506 > 10.33.0.55.19722: UDP, length 172
14:28:14.339122 IP 10.1.2.112.13506 > 10.33.0.55.19722: UDP, length 172
14:28:14.359231 IP 10.1.2.112.13506 > 10.33.0.55.19722: UDP, length 172
14:28:14.379385 IP 10.1.2.112.13506 > 10.33.0.55.19722: UDP, length 172
14:28:14.398951 IP 10.1.2.112.13506 > 10.33.0.55.19722: UDP, length 172
14:28:14.419202 IP 10.1.2.112.13506 > 10.33.0.55.19722: UDP, length 172
14:28:14.439367 IP 10.1.2.112.13506 > 10.33.0.55.19722: UDP, length 172
14:28:14.459699 IP 10.1.2.112.13506 > 10.33.0.55.19722: UDP, length 172
