seman@mediagtw:~$ sudo tcpdump -i eth0 -n host 10.33.0.55 and udp and portrange 10000-20000 -c 30
tcpdump: verbose output suppressed, use -v[v]... for full protocol decode
listening on eth0, link-type EN10MB (Ethernet), snapshot length 262144 bytes
13:35:18.829912 IP 10.1.2.112.19298 > 10.33.0.55.12670: UDP, length 172
13:35:18.849903 IP 10.1.2.112.19298 > 10.33.0.55.12670: UDP, length 172
13:35:18.869912 IP 10.1.2.112.19298 > 10.33.0.55.12670: UDP, length 172
13:35:18.889895 IP 10.1.2.112.19298 > 10.33.0.55.12670: UDP, length 172
13:35:18.909894 IP 10.1.2.112.19298 > 10.33.0.55.12670: UDP, length 172
13:35:18.929899 IP 10.1.2.112.19298 > 10.33.0.55.12670: UDP, length 172
13:35:18.949892 IP 10.1.2.112.19298 > 10.33.0.55.12670: UDP, length 172
13:35:18.969892 IP 10.1.2.112.19298 > 10.33.0.55.12670: UDP, length 172
13:35:18.989892 IP 10.1.2.112.19298 > 10.33.0.55.12670: UDP, length 172
13:35:19.009894 IP 10.1.2.112.19298 > 10.33.0.55.12670: UDP, length 172
13:35:19.029895 IP 10.1.2.112.19298 > 10.33.0.55.12670: UDP, length 172
13:35:19.049892 IP 10.1.2.112.19298 > 10.33.0.55.12670: UDP, length 172
13:35:19.069891 IP 10.1.2.112.19298 > 10.33.0.55.12670: UDP, length 172
13:35:19.089893 IP 10.1.2.112.19298 > 10.33.0.55.12670: UDP, length 172
13:35:19.109890 IP 10.1.2.112.19298 > 10.33.0.55.12670: UDP, length 172
13:35:19.129895 IP 10.1.2.112.19298 > 10.33.0.55.12670: UDP, length 172
13:35:19.149892 IP 10.1.2.112.19298 > 10.33.0.55.12670: UDP, length 172
13:35:19.169892 IP 10.1.2.112.19298 > 10.33.0.55.12670: UDP, length 172
13:35:19.189901 IP 10.1.2.112.19298 > 10.33.0.55.12670: UDP, length 172
13:35:19.209896 IP 10.1.2.112.19298 > 10.33.0.55.12670: UDP, length 172
13:35:19.229895 IP 10.1.2.112.19298 > 10.33.0.55.12670: UDP, length 172
13:35:19.249893 IP 10.1.2.112.19298 > 10.33.0.55.12670: UDP, length 172
13:35:19.269894 IP 10.1.2.112.19298 > 10.33.0.55.12670: UDP, length 172
13:35:19.289931 IP 10.1.2.112.19298 > 10.33.0.55.12670: UDP, length 172
13:35:19.309921 IP 10.1.2.112.19298 > 10.33.0.55.12670: UDP, length 172
13:35:19.329905 IP 10.1.2.112.19298 > 10.33.0.55.12670: UDP, length 172
13:35:19.349901 IP 10.1.2.112.19298 > 10.33.0.55.12670: UDP, length 172
13:35:19.369894 IP 10.1.2.112.19298 > 10.33.0.55.12670: UDP, length 172
13:35:19.389898 IP 10.1.2.112.19298 > 10.33.0.55.12670: UDP, length 172
13:35:19.409899 IP 10.1.2.112.19298 > 10.33.0.55.12670: UDP, length 172
30 packets captured
31 packets received by filter
0 packets dropped by kernel