tcpdump: verbose output suppressed, use -v[v]... for full protocol decode
listening on any, link-type LINUX_SLL2 (Linux cooked v2), snapshot length 262144 bytes
11:09:33.612669 eth0  Out IP 10.1.2.112.17846 > 10.33.0.55.15052: UDP, length 13
11:09:36.604337 eth0  Out IP 10.1.2.112.17846 > 10.33.0.55.15052: UDP, length 172
11:09:36.624384 eth0  Out IP 10.1.2.112.17846 > 10.33.0.55.15052: UDP, length 172
11:09:36.644375 eth0  Out IP 10.1.2.112.17846 > 10.33.0.55.15052: UDP, length 172
11:09:36.664375 eth0  Out IP 10.1.2.112.17846 > 10.33.0.55.15052: UDP, length 172
11:09:36.684398 eth0  Out IP 10.1.2.112.17846 > 10.33.0.55.15052: UDP, length 172
11:09:36.704380 eth0  Out IP 10.1.2.112.17846 > 10.33.0.55.15052: UDP, length 172
11:09:36.724380 eth0  Out IP 10.1.2.112.17846 > 10.33.0.55.15052: UDP, length 172
11:09:36.744378 eth0  Out IP 10.1.2.112.17846 > 10.33.0.55.15052: UDP, length 172
11:09:36.764379 eth0  Out IP 10.1.2.112.17846 > 10.33.0.55.15052: UDP, length 172
11:09:36.784382 eth0  Out IP 10.1.2.112.17846 > 10.33.0.55.15052: UDP, length 172
11:09:36.804378 eth0  Out IP 10.1.2.112.17846 > 10.33.0.55.15052: UDP, length 172
11:09:36.824378 eth0  Out IP 10.1.2.112.17846 > 10.33.0.55.15052: UDP, length 172
11:09:36.844391 eth0  Out IP 10.1.2.112.17846 > 10.33.0.55.15052: UDP, length 172
11:09:36.864375 eth0  Out IP 10.1.2.112.17846 > 10.33.0.55.15052: UDP, length 172
11:09:36.884377 eth0  Out IP 10.1.2.112.17846 > 10.33.0.55.15052: UDP, length 172
11:09:36.904382 eth0  Out IP 10.1.2.112.17846 > 10.33.0.55.15052: UDP, length 172
11:09:36.924406 eth0  Out IP 10.1.2.112.17846 > 10.33.0.55.15052: UDP, length 172
11:09:36.944375 eth0  Out IP 10.1.2.112.17846 > 10.33.0.55.15052: UDP, length 172
11:09:36.960990 eth0  Out IP 10.1.2.112.17846 > 10.33.0.55.15052: UDP, length 172
11:09:36.980934 eth0  Out IP 10.1.2.112.17846 > 10.33.0.55.15052: UDP, length 172
11:09:37.000837 eth0  Out IP 10.1.2.112.17846 > 10.33.0.55.15052: UDP, length 172
11:09:37.020934 eth0  Out IP 10.1.2.112.17846 > 10.33.0.55.15052: UDP, length 172
11:09:37.041027 eth0  Out IP 10.1.2.112.17846 > 10.33.0.55.15052: UDP, length 172
11:09:37.060823 eth0  Out IP 10.1.2.112.17846 > 10.33.0.55.15052: UDP, length 172
11:09:37.081014 eth0  Out IP 10.1.2.112.17846 > 10.33.0.55.15052: UDP, length 172
11:09:37.100858 eth0  Out IP 10.1.2.112.17846 > 10.33.0.55.15052: UDP, length 172
11:09:37.120907 eth0  Out IP 10.1.2.112.17846 > 10.33.0.55.15052: UDP, length 172
11:09:37.141320 eth0  Out IP 10.1.2.112.17846 > 10.33.0.55.15052: UDP, length 172
11:09:37.161772 eth0  Out IP 10.1.2.112.17846 > 10.33.0.55.15052: UDP, length 172
30 packets captured
34 packets received by filter
0 packets dropped by kernel