18:31:08.161586 IP 10.33.0.55.14048 > 10.1.2.112.14666: UDP, length 172
18:31:08.174947 IP 10.1.2.112.14666 > 10.33.0.55.14048: UDP, length 172
18:31:08.174959 IP 10.33.0.55.13376 > 89.238.205.74.57550: UDP, length 172
18:31:08.181635 IP 89.238.205.74.57550 > 10.33.0.55.13376: UDP, length 172
18:31:08.181645 IP 10.33.0.55.14048 > 10.1.2.112.14666: UDP, length 172
18:31:08.181871 IP 10.1.2.112.14666 > 10.33.0.55.14048: UDP, length 172
18:31:08.181881 IP 10.33.0.55.13376 > 89.238.205.74.57550: UDP, length 172
18:31:08.201674 IP 89.238.205.74.57550 > 10.33.0.55.13376: UDP, length 172
18:31:08.201719 IP 10.33.0.55.14048 > 10.1.2.112.14666: UDP, length 172
18:31:08.214678 IP 10.1.2.112.14666 > 10.33.0.55.14048: UDP, length 172
18:31:08.214722 IP 10.33.0.55.13376 > 89.238.205.74.57550: UDP, length 172
18:31:08.221486 IP 89.238.205.74.57550 > 10.33.0.55.13376: UDP, length 172
18:31:08.221529 IP 10.33.0.55.14048 > 10.1.2.112.14666: UDP, length 172
18:31:08.235366 IP 10.1.2.112.14666 > 10.33.0.55.14048: UDP, length 172
18:31:08.235450 IP 10.33.0.55.13376 > 89.238.205.74.57550: UDP, length 172
18:31:08.241425 IP 89.238.205.74.57550 > 10.33.0.55.13376: UDP, length 172
18:31:08.241454 IP 10.33.0.55.14048 > 10.1.2.112.14666: UDP, length 172
18:31:08.255655 IP 10.1.2.112.14666 > 10.33.0.55.14048: UDP, length 172
18:31:08.255691 IP 10.33.0.55.13376 > 89.238.205.74.57550: UDP, length 172
18:31:08.261542 IP 89.238.205.74.57550 > 10.33.0.55.13376: UDP, length 172
18:31:08.261557 IP 10.33.0.55.14048 > 10.1.2.112.14666: UDP, length 172
18:31:08.263222 IP 10.1.2.112.14666 > 10.33.0.55.14048: UDP, length 172
18:31:08.263233 IP 10.33.0.55.13376 > 89.238.205.74.57550: UDP, length 172
18:31:08.281507 IP 89.238.205.74.57550 > 10.33.0.55.13376: UDP, length 172
18:31:08.281519 IP 10.33.0.55.14048 > 10.1.2.112.14666: UDP, length 172
18:31:08.295632 IP 10.1.2.112.14666 > 10.33.0.55.14048: UDP, length 172
18:31:08.295643 IP 10.33.0.55.13376 > 89.238.205.74.57550: UDP, length 172
18:31:08.301500 IP 89.238.205.74.57550 > 10.33.0.55.13376: UDP, length 172
18:31:08.301511 IP 10.33.0.55.14048 > 10.1.2.112.14666: UDP, length 172
18:31:08.315145 IP 10.1.2.112.14666 > 10.33.0.55.14048: UDP, length 172
18:31:08.315157 IP 10.33.0.55.13376 > 89.238.205.74.57550: UDP, length 172
18:31:08.321559 IP 10.1.2.112.14666 > 10.33.0.55.14048: UDP, length 172
18:31:08.321570 IP 10.33.0.55.13376 > 89.238.205.74.57550: UDP, length 172
18:31:08.321575 IP 89.238.205.74.57550 > 10.33.0.55.13376: UDP, length 172
18:31:08.321597 IP 10.33.0.55.14048 > 10.1.2.112.14666: UDP, length 172
18:31:08.341678 IP 89.238.205.74.57550 > 10.33.0.55.13376: UDP, length 172
18:31:08.341690 IP 10.33.0.55.14048 > 10.1.2.112.14666: UDP, length 172
18:31:08.354890 IP 10.1.2.112.14666 > 10.33.0.55.14048: UDP, length 172
18:31:08.354901 IP 10.33.0.55.13376 > 89.238.205.74.57550: UDP, length 172
18:31:08.361609 IP 89.238.205.74.57550 > 10.33.0.55.13376: UDP, length 172
18:31:08.361620 IP 10.33.0.55.14048 > 10.1.2.112.14666: UDP, length 172
18:31:08.375508 IP 10.1.2.112.14666 > 10.33.0.55.14048: UDP, length 172
18:31:08.375518 IP 10.33.0.55.13376 > 89.238.205.74.57550: UDP, length 172
18:31:08.381480 IP 89.238.205.74.57550 > 10.33.0.55.13376: UDP, length 172
18:31:08.381492 IP 10.33.0.55.14048 > 10.1.2.112.14666: UDP, length 172
18:31:08.381683 IP 10.1.2.112.14666 > 10.33.0.55.14048: UDP, length 172
18:31:08.381694 IP 10.33.0.55.13376 > 89.238.205.74.57550: UDP, length 172
18:31:08.401579 IP 89.238.205.74.57550 > 10.33.0.55.13376: UDP, length 172
18:31:08.401590 IP 10.33.0.55.14048 > 10.1.2.112.14666: UDP, length 172
18:31:08.414778 IP 10.1.2.112.14666 > 10.33.0.55.14048: UDP, length 172
18:31:08.416071 IP 10.33.0.55.13376 > 89.238.205.74.57550: UDP, length 172
18:31:08.421530 IP 89.238.205.74.57550 > 10.33.0.55.13376: UDP, length 172
18:31:08.421550 IP 10.33.0.55.14048 > 10.1.2.112.14666: UDP, length 172
18:31:08.434797 IP 10.1.2.112.14666 > 10.33.0.55.14048: UDP, length 172
18:31:08.434810 IP 10.33.0.55.13376 > 89.238.205.74.57550: UDP, length 172
18:31:08.441561 IP 89.238.205.74.57550 > 10.33.0.55.13376: UDP, length 172
18:31:08.441573 IP 10.33.0.55.14048 > 10.1.2.112.14666: UDP, length 172
18:31:08.449997 IP 10.1.2.112.14666 > 10.33.0.55.14048: UDP, length 172
18:31:08.450008 IP 10.33.0.55.13376 > 89.238.205.74.57550: UDP, length 172
18:31:08.461502 IP 89.238.205.74.57550 > 10.33.0.55.13376: UDP, length 172
18:31:08.461513 IP 10.33.0.55.14048 > 10.1.2.112.14666: UDP, length 172
18:31:08.474477 IP 10.1.2.112.14666 > 10.33.0.55.14048: UDP, length 172
18:31:08.474489 IP 10.33.0.55.13376 > 89.238.205.74.57550: UDP, length 172
18:31:08.481444 IP 89.238.205.74.57550 > 10.33.0.55.13376: UDP, length 172
18:31:08.481455 IP 10.33.0.55.14048 > 10.1.2.112.14666: UDP, length 172
18:31:08.501561 IP 89.238.205.74.57550 > 10.33.0.55.13376: UDP, length 172
18:31:08.501573 IP 10.33.0.55.14048 > 10.1.2.112.14666: UDP, length 172
18:31:08.515114 IP 10.1.2.112.14666 > 10.33.0.55.14048: UDP, length 172
18:31:08.515116 IP 10.1.2.112.14666 > 10.33.0.55.14048: UDP, length 172
18:31:08.515129 IP 10.33.0.55.13376 > 89.238.205.74.57550: UDP, length 172
18:31:08.515134 IP 10.33.0.55.13376 > 89.238.205.74.57550: UDP, length 172
18:31:08.521591 IP 89.238.205.74.57550 > 10.33.0.55.13376: UDP, length 172
18:31:08.521602 IP 10.33.0.55.14048 > 10.1.2.112.14666: UDP, length 172
18:31:08.541663 IP 89.238.205.74.57550 > 10.33.0.55.13376: UDP, length 172
18:31:08.541676 IP 10.33.0.55.14048 > 10.1.2.112.14666: UDP, length 172
18:31:08.542911 IP 10.1.2.112.14666 > 10.33.0.55.14048: UDP, length 172
18:31:08.542922 IP 10.33.0.55.13376 > 89.238.205.74.57550: UDP, length 172
18:31:08.549763 IP 10.1.2.112.14666 > 10.33.0.55.14048: UDP, length 172
18:31:08.549787 IP 10.33.0.55.13376 > 89.238.205.74.57550: UDP, length 172
18:31:08.561483 IP 89.238.205.74.57550 > 10.33.0.55.13376: UDP, length 172
18:31:08.561496 IP 10.33.0.55.14048 > 10.1.2.112.14666: UDP, length 172
18:31:08.574893 IP 10.1.2.112.14666 > 10.33.0.55.14048: UDP, length 172
18:31:08.574905 IP 10.33.0.55.13376 > 89.238.205.74.57550: UDP, length 172
18:31:08.581612 IP 89.238.205.74.57550 > 10.33.0.55.13376: UDP, length 172
18:31:08.581624 IP 10.33.0.55.14048 > 10.1.2.112.14666: UDP, length 172
18:31:08.595065 IP 10.1.2.112.14666 > 10.33.0.55.14048: UDP, length 172
18:31:08.595078 IP 10.33.0.55.13376 > 89.238.205.74.57550: UDP, length 172
18:31:08.601602 IP 89.238.205.74.57550 > 10.33.0.55.13376: UDP, length 172
18:31:08.601613 IP 10.33.0.55.14048 > 10.1.2.112.14666: UDP, length 172
18:31:08.603333 IP 10.1.2.112.14666 > 10.33.0.55.14048: UDP, length 172
18:31:08.603347 IP 10.33.0.55.13376 > 89.238.205.74.57550: UDP, length 172
18:31:08.621671 IP 89.238.205.74.57550 > 10.33.0.55.13376: UDP, length 172
18:31:08.621683 IP 10.33.0.55.14048 > 10.1.2.112.14666: UDP, length 172
18:31:08.641609 IP 89.238.205.74.57550 > 10.33.0.55.13376: UDP, length 172
18:31:08.641621 IP 10.33.0.55.14048 > 10.1.2.112.14666: UDP, length 172
18:31:08.642795 IP 10.1.2.112.14666 > 10.33.0.55.14048: UDP, length 172
18:31:08.642806 IP 10.33.0.55.13376 > 89.238.205.74.57550: UDP, length 172
18:31:08.650540 IP 10.1.2.112.14666 > 10.33.0.55.14048: UDP, length 172
18:31:08.650551 IP 10.33.0.55.13376 > 89.238.205.74.57550: UDP, length 172
18:31:08.661466 IP 89.238.205.74.57550 > 10.33.0.55.13376: UDP, length 172
18:31:08.661477 IP 10.33.0.55.14048 > 10.1.2.112.14666: UDP, length 172
18:31:08.674606 IP 10.1.2.112.14666 > 10.33.0.55.14048: UDP, length 172
18:31:08.674618 IP 10.33.0.55.13376 > 89.238.205.74.57550: UDP, length 172
18:31:08.681662 IP 89.238.205.74.57550 > 10.33.0.55.13376: UDP, length 172
18:31:08.681674 IP 10.33.0.55.14048 > 10.1.2.112.14666: UDP, length 172
18:31:08.682369 IP 10.1.2.112.14666 > 10.33.0.55.14048: UDP, length 172
18:31:08.682379 IP 10.33.0.55.13376 > 89.238.205.74.57550: UDP, length 172
18:31:08.701564 IP 89.238.205.74.57550 > 10.33.0.55.13376: UDP, length 172
18:31:08.701577 IP 10.33.0.55.14048 > 10.1.2.112.14666: UDP, length 172
18:31:08.714636 IP 10.1.2.112.14666 > 10.33.0.55.14048: UDP, length 172
18:31:08.714647 IP 10.33.0.55.13376 > 89.238.205.74.57550: UDP, length 172
18:31:08.721583 IP 89.238.205.74.57550 > 10.33.0.55.13376: UDP, length 172
18:31:08.721594 IP 10.33.0.55.14048 > 10.1.2.112.14666: UDP, length 172
18:31:08.721687 IP 10.1.2.112.14666 > 10.33.0.55.14048: UDP, length 172
18:31:08.721696 IP 10.33.0.55.13376 > 89.238.205.74.57550: UDP, length 172
18:31:08.741534 IP 89.238.205.74.57550 > 10.33.0.55.13376: UDP, length 172
18:31:08.741546 IP 10.33.0.55.14048 > 10.1.2.112.14666: UDP, length 172
18:31:08.754686 IP 10.1.2.112.14666 > 10.33.0.55.14048: UDP, length 172
18:31:08.754697 IP 10.33.0.55.13376 > 89.238.205.74.57550: UDP, length 172
18:31:08.761541 IP 89.238.205.74.57550 > 10.33.0.55.13376: UDP, length 172
18:31:08.761552 IP 10.33.0.55.14048 > 10.1.2.112.14666: UDP, length 172
18:31:08.761722 IP 10.1.2.112.14666 > 10.33.0.55.14048: UDP, length 172
18:31:08.761732 IP 10.33.0.55.13376 > 89.238.205.74.57550: UDP, length 172
18:31:08.781527 IP 89.238.205.74.57550 > 10.33.0.55.13376: UDP, length 172
18:31:08.781539 IP 10.33.0.55.14048 > 10.1.2.112.14666: UDP, length 172
18:31:08.795149 IP 10.1.2.112.14666 > 10.33.0.55.14048: UDP, length 172
18:31:08.795161 IP 10.33.0.55.13376 > 89.238.205.74.57550: UDP, length 172
18:31:08.801628 IP 89.238.205.74.57550 > 10.33.0.55.13376: UDP, length 172
18:31:08.801639 IP 10.33.0.55.14048 > 10.1.2.112.14666: UDP, length 172
18:31:08.803245 IP 10.1.2.112.14666 > 10.33.0.55.14048: UDP, length 172
18:31:08.803255 IP 10.33.0.55.13376 > 89.238.205.74.57550: UDP, length 172
18:31:08.821609 IP 89.238.205.74.57550 > 10.33.0.55.13376: UDP, length 172
18:31:08.821620 IP 10.33.0.55.14048 > 10.1.2.112.14666: UDP, length 172
18:31:08.835889 IP 10.1.2.112.14666 > 10.33.0.55.14048: UDP, length 172
18:31:08.835902 IP 10.33.0.55.13376 > 89.238.205.74.57550: UDP, length 172
18:31:08.841611 IP 89.238.205.74.57550 > 10.33.0.55.13376: UDP, length 172
18:31:08.841641 IP 10.33.0.55.14048 > 10.1.2.112.14666: UDP, length 172
18:31:08.854440 IP 10.1.2.112.14666 > 10.33.0.55.14048: UDP, length 172
18:31:08.854457 IP 10.33.0.55.13376 > 89.238.205.74.57550: UDP, length 172
18:31:08.861338 IP 10.1.2.112.14666 > 10.33.0.55.14048: UDP, length 172
18:31:08.861350 IP 10.33.0.55.13376 > 89.238.205.74.57550: UDP, length 172
18:31:08.861494 IP 89.238.205.74.57550 > 10.33.0.55.13376: UDP, length 172
18:31:08.861505 IP 10.33.0.55.14048 > 10.1.2.112.14666: UDP, length 172
18:31:08.881540 IP 89.238.205.74.57550 > 10.33.0.55.13376: UDP, length 172
18:31:08.881552 IP 10.33.0.55.14048 > 10.1.2.112.14666: UDP, length 172
18:31:08.895000 IP 10.1.2.112.14666 > 10.33.0.55.14048: UDP, length 172
18:31:08.895011 IP 10.33.0.55.13376 > 89.238.205.74.57550: UDP, length 172
18:31:08.901490 IP 89.238.205.74.57550 > 10.33.0.55.13376: UDP, length 172
18:31:08.901501 IP 10.33.0.55.14048 > 10.1.2.112.14666: UDP, length 172
18:31:08.914731 IP 10.1.2.112.14666 > 10.33.0.55.14048: UDP, length 172
18:31:08.914744 IP 10.33.0.55.13376 > 89.238.205.74.57550: UDP, length 172
18:31:08.921434 IP 89.238.205.74.57550 > 10.33.0.55.13376: UDP, length 172
18:31:08.921445 IP 10.33.0.55.14048 > 10.1.2.112.14666: UDP, length 172
18:31:08.922027 IP 10.1.2.112.14666 > 10.33.0.55.14048: UDP, length 172
18:31:08.922037 IP 10.33.0.55.13376 > 89.238.205.74.57550: UDP, length 172
18:31:08.941585 IP 89.238.205.74.57550 > 10.33.0.55.13376: UDP, length 172
18:31:08.941597 IP 10.33.0.55.14048 > 10.1.2.112.14666: UDP, length 172
18:31:08.961536 IP 89.238.205.74.57550 > 10.33.0.55.13376: UDP, length 172
18:31:08.961547 IP 10.33.0.55.14048 > 10.1.2.112.14666: UDP, length 172
18:31:08.963565 IP 10.1.2.112.14666 > 10.33.0.55.14048: UDP, length 172
18:31:08.963576 IP 10.33.0.55.13376 > 89.238.205.74.57550: UDP, length 172
18:31:08.963672 IP 10.1.2.112.14666 > 10.33.0.55.14048: UDP, length 172
18:31:08.963680 IP 10.33.0.55.13376 > 89.238.205.74.57550: UDP, length 172
18:31:08.981515 IP 89.238.205.74.57550 > 10.33.0.55.13376: UDP, length 172
18:31:08.981527 IP 10.33.0.55.14048 > 10.1.2.112.14666: UDP, length 172
18:31:08.995576 IP 10.1.2.112.14666 > 10.33.0.55.14048: UDP, length 172
18:31:08.995592 IP 10.33.0.55.13376 > 89.238.205.74.57550: UDP, length 172
18:31:09.001650 IP 89.238.205.74.57550 > 10.33.0.55.13376: UDP, length 172
18:31:09.001675 IP 10.33.0.55.14048 > 10.1.2.112.14666: UDP, length 172
18:31:09.014413 IP 10.1.2.112.14666 > 10.33.0.55.14048: UDP, length 172
18:31:09.014426 IP 10.33.0.55.13376 > 89.238.205.74.57550: UDP, length 172
18:31:09.021542 IP 89.238.205.74.57550 > 10.33.0.55.13376: UDP, length 172
18:31:09.021553 IP 10.33.0.55.14048 > 10.1.2.112.14666: UDP, length 172
18:31:09.036675 IP 10.1.2.112.14666 > 10.33.0.55.14048: UDP, length 172
18:31:09.036696 IP 10.33.0.55.13376 > 89.238.205.74.57550: UDP, length 172
18:31:09.041416 IP 89.238.205.74.57550 > 10.33.0.55.13376: UDP, length 172
18:31:09.041428 IP 10.33.0.55.14048 > 10.1.2.112.14666: UDP, length 172
18:31:09.041781 IP 10.1.2.112.14666 > 10.33.0.55.14048: UDP, length 172
18:31:09.041792 IP 10.33.0.55.13376 > 89.238.205.74.57550: UDP, length 172
18:31:09.061479 IP 89.238.205.74.57550 > 10.33.0.55.13376: UDP, length 172
18:31:09.061491 IP 10.33.0.55.14048 > 10.1.2.112.14666: UDP, length 172
18:31:09.074305 IP 10.1.2.112.14666 > 10.33.0.55.14048: UDP, length 172
18:31:09.074316 IP 10.33.0.55.13376 > 89.238.205.74.57550: UDP, length 172
18:31:09.081496 IP 89.238.205.74.57550 > 10.33.0.55.13376: UDP, length 172
18:31:09.081507 IP 10.33.0.55.14048 > 10.1.2.112.14666: UDP, length 172
18:31:09.094722 IP 10.1.2.112.14666 > 10.33.0.55.14048: UDP, length 172
18:31:09.094732 IP 10.33.0.55.13376 > 89.238.205.74.57550: UDP, length 172
18:31:09.101462 IP 89.238.205.74.57550 > 10.33.0.55.13376: UDP, length 172
18:31:09.101473 IP 10.33.0.55.14048 > 10.1.2.112.14666: UDP, length 172
18:31:09.101766 IP 10.1.2.112.14666 > 10.33.0.55.14048: UDP, length 172
18:31:09.101777 IP 10.33.0.55.13376 > 89.238.205.74.57550: UDP, length 172
18:31:09.121532 IP 89.238.205.74.57550 > 10.33.0.55.13376: UDP, length 172
18:31:09.121550 IP 10.33.0.55.14048 > 10.1.2.112.14666: UDP, length 172
18:31:09.134402 IP 10.1.2.112.14666 > 10.33.0.55.14048: UDP, length 172
18:31:09.134414 IP 10.33.0.55.13376 > 89.238.205.74.57550: UDP, length 172
18:31:09.141498 IP 89.238.205.74.57550 > 10.33.0.55.13376: UDP, length 172
18:31:09.141509 IP 10.33.0.55.14048 > 10.1.2.112.14666: UDP, length 172
18:31:09.154805 IP 10.1.2.112.14666 > 10.33.0.55.14048: UDP, length 172
18:31:09.154816 IP 10.33.0.55.13376 > 89.238.205.74.57550: UDP, length 172
18:31:09.161416 IP 89.238.205.74.57550 > 10.33.0.55.13376: UDP, length 172
18:31:09.161430 IP 10.33.0.55.14048 > 10.1.2.112.14666: UDP, length 172
18:31:09.162454 IP 10.1.2.112.14666 > 10.33.0.55.14048: UDP, length 172
18:31:09.162465 IP 10.33.0.55.13376 > 89.238.205.74.57550: UDP, length 172
18:31:09.181490 IP 89.238.205.74.57550 > 10.33.0.55.13376: UDP, length 172
18:31:09.181502 IP 10.33.0.55.14048 > 10.1.2.112.14666: UDP, length 172
18:31:09.194687 IP 10.1.2.112.14666 > 10.33.0.55.14048: UDP, length 172
18:31:09.194698 IP 10.33.0.55.13376 > 89.238.205.74.57550: UDP, length 172
18:31:09.201485 IP 89.238.205.74.57550 > 10.33.0.55.13376: UDP, length 172
18:31:09.201498 IP 10.33.0.55.14048 > 10.1.2.112.14666: UDP, length 172
18:31:09.214599 IP 10.1.2.112.14666 > 10.33.0.55.14048: UDP, length 172
18:31:09.214611 IP 10.33.0.55.13376 > 89.238.205.74.57550: UDP, length 172
18:31:09.221630 IP 89.238.205.74.57550 > 10.33.0.55.13376: UDP, length 172
18:31:09.221641 IP 10.33.0.55.14048 > 10.1.2.112.14666: UDP, length 172
18:31:09.222265 IP 10.1.2.112.14666 > 10.33.0.55.14048: UDP, length 172
18:31:09.222276 IP 10.33.0.55.13376 > 89.238.205.74.57550: UDP, length 172
18:31:09.241569 IP 89.238.205.74.57550 > 10.33.0.55.13376: UDP, length 172
18:31:09.241580 IP 10.33.0.55.14048 > 10.1.2.112.14666: UDP, length 172
18:31:09.254606 IP 10.1.2.112.14666 > 10.33.0.55.14048: UDP, length 172
18:31:09.254617 IP 10.33.0.55.13376 > 89.238.205.74.57550: UDP, length 172
18:31:09.261484 IP 89.238.205.74.57550 > 10.33.0.55.13376: UDP, length 172
18:31:09.261495 IP 10.33.0.55.14048 > 10.1.2.112.14666: UDP, length 172
18:31:09.274592 IP 10.1.2.112.14666 > 10.33.0.55.14048: UDP, length 172
18:31:09.274604 IP 10.33.0.55.13376 > 89.238.205.74.57550: UDP, length 172
18:31:09.281401 IP 10.1.2.112.14666 > 10.33.0.55.14048: UDP, length 172
18:31:09.281412 IP 10.33.0.55.13376 > 89.238.205.74.57550: UDP, length 172
18:31:09.281542 IP 89.238.205.74.57550 > 10.33.0.55.13376: UDP, length 172
18:31:09.281553 IP 10.33.0.55.14048 > 10.1.2.112.14666: UDP, length 172
18:31:09.301577 IP 89.238.205.74.57550 > 10.33.0.55.13376: UDP, length 172
18:31:09.301589 IP 10.33.0.55.14048 > 10.1.2.112.14666: UDP, length 172
18:31:09.315587 IP 10.1.2.112.14666 > 10.33.0.55.14048: UDP, length 172
18:31:09.315598 IP 10.33.0.55.13376 > 89.238.205.74.57550: UDP, length 172
18:31:09.321596 IP 89.238.205.74.57550 > 10.33.0.55.13376: UDP, length 172
18:31:09.321607 IP 10.33.0.55.14048 > 10.1.2.112.14666: UDP, length 172
18:31:09.334864 IP 10.1.2.112.14666 > 10.33.0.55.14048: UDP, length 172
18:31:09.334876 IP 10.33.0.55.13376 > 89.238.205.74.57550: UDP, length 172
18:31:09.341640 IP 89.238.205.74.57550 > 10.33.0.55.13376: UDP, length 172
18:31:09.341650 IP 10.33.0.55.14048 > 10.1.2.112.14666: UDP, length 172
18:31:09.342674 IP 10.1.2.112.14666 > 10.33.0.55.14048: UDP, length 172
18:31:09.342684 IP 10.33.0.55.13376 > 89.238.205.74.57550: UDP, length 172
18:31:09.361575 IP 89.238.205.74.57550 > 10.33.0.55.13376: UDP, length 172
18:31:09.361588 IP 10.33.0.55.14048 > 10.1.2.112.14666: UDP, length 172
18:31:09.375967 IP 10.1.2.112.14666 > 10.33.0.55.14048: UDP, length 172
18:31:09.375978 IP 10.33.0.55.13376 > 89.238.205.74.57550: UDP, length 172
18:31:09.381544 IP 89.238.205.74.57550 > 10.33.0.55.13376: UDP, length 172
18:31:09.381555 IP 10.33.0.55.14048 > 10.1.2.112.14666: UDP, length 172
18:31:09.382613 IP 10.1.2.112.14666 > 10.33.0.55.14048: UDP, length 172
18:31:09.382623 IP 10.33.0.55.13376 > 89.238.205.74.57550: UDP, length 172
18:31:09.401539 IP 89.238.205.74.57550 > 10.33.0.55.13376: UDP, length 172
18:31:09.401550 IP 10.33.0.55.14048 > 10.1.2.112.14666: UDP, length 172
18:31:09.408338 IP 10.1.2.112.14666 > 10.33.0.55.14048: UDP, length 172
18:31:09.408349 IP 10.33.0.55.13376 > 89.238.205.74.57550: UDP, length 172
18:31:09.421775 IP 89.238.205.74.57550 > 10.33.0.55.13376: UDP, length 172
18:31:09.421786 IP 10.33.0.55.14048 > 10.1.2.112.14666: UDP, length 172
18:31:09.429019 IP 10.1.2.112.14666 > 10.33.0.55.14048: UDP, length 172
18:31:09.429031 IP 10.33.0.55.13376 > 89.238.205.74.57550: UDP, length 172
18:31:09.441568 IP 89.238.205.74.57550 > 10.33.0.55.13376: UDP, length 172
18:31:09.441579 IP 10.33.0.55.14048 > 10.1.2.112.14666: UDP, length 172
18:31:09.442730 IP 10.1.2.112.14666 > 10.33.0.55.14048: UDP, length 172
18:31:09.442740 IP 10.33.0.55.13376 > 89.238.205.74.57550: UDP, length 172
18:31:09.461707 IP 89.238.205.74.57550 > 10.33.0.55.13376: UDP, length 172
18:31:09.461730 IP 10.33.0.55.14048 > 10.1.2.112.14666: UDP, length 172
18:31:09.468626 IP 10.1.2.112.14666 > 10.33.0.55.14048: UDP, length 172
18:31:09.468638 IP 10.33.0.55.13376 > 89.238.205.74.57550: UDP, length 172
18:31:09.481483 IP 89.238.205.74.57550 > 10.33.0.55.13376: UDP, length 172
18:31:09.481495 IP 10.33.0.55.14048 > 10.1.2.112.14666: UDP, length 172
18:31:09.488152 IP 10.1.2.112.14666 > 10.33.0.55.14048: UDP, length 172
18:31:09.488164 IP 10.33.0.55.13376 > 89.238.205.74.57550: UDP, length 172
18:31:09.501664 IP 89.238.205.74.57550 > 10.33.0.55.13376: UDP, length 172
18:31:09.501676 IP 10.33.0.55.14048 > 10.1.2.112.14666: UDP, length 172
18:31:09.509727 IP 10.1.2.112.14666 > 10.33.0.55.14048: UDP, length 172
18:31:09.509738 IP 10.33.0.55.13376 > 89.238.205.74.57550: UDP, length 172
18:31:09.521390 IP 89.238.205.74.57550 > 10.33.0.55.13376: UDP, length 172
18:31:09.521401 IP 10.33.0.55.14048 > 10.1.2.112.14666: UDP, length 172
18:31:09.528389 IP 10.1.2.112.14666 > 10.33.0.55.14048: UDP, length 172
18:31:09.528400 IP 10.33.0.55.13376 > 89.238.205.74.57550: UDP, length 172
18:31:09.541461 IP 89.238.205.74.57550 > 10.33.0.55.13376: UDP, length 172
18:31:09.541473 IP 10.33.0.55.14048 > 10.1.2.112.14666: UDP, length 172
18:31:09.548952 IP 10.1.2.112.14666 > 10.33.0.55.14048: UDP, length 172
18:31:09.548966 IP 10.33.0.55.13376 > 89.238.205.74.57550: UDP, length 172
18:31:09.561492 IP 89.238.205.74.57550 > 10.33.0.55.13376: UDP, length 172
18:31:09.561504 IP 10.33.0.55.14048 > 10.1.2.112.14666: UDP, length 172
18:31:09.568471 IP 10.1.2.112.14666 > 10.33.0.55.14048: UDP, length 172
18:31:09.568482 IP 10.33.0.55.13376 > 89.238.205.74.57550: UDP, length 172
18:31:09.581509 IP 89.238.205.74.57550 > 10.33.0.55.13376: UDP, length 172
18:31:09.581521 IP 10.33.0.55.14048 > 10.1.2.112.14666: UDP, length 172
18:31:09.588788 IP 10.1.2.112.14666 > 10.33.0.55.14048: UDP, length 172
18:31:09.588800 IP 10.33.0.55.13376 > 89.238.205.74.57550: UDP, length 172
18:31:09.601507 IP 89.238.205.74.57550 > 10.33.0.55.13376: UDP, length 172
18:31:09.601519 IP 10.33.0.55.14048 > 10.1.2.112.14666: UDP, length 172
18:31:09.621597 IP 89.238.205.74.57550 > 10.33.0.55.13376: UDP, length 172
18:31:09.621608 IP 10.33.0.55.14048 > 10.1.2.112.14666: UDP, length 172
18:31:09.629186 IP 10.1.2.112.14666 > 10.33.0.55.14048: UDP, length 172
18:31:09.629198 IP 10.33.0.55.13376 > 89.238.205.74.57550: UDP, length 172
18:31:09.635821 IP 10.1.2.112.14666 > 10.33.0.55.14048: UDP, length 172
18:31:09.635832 IP 10.33.0.55.13376 > 89.238.205.74.57550: UDP, length 172
18:31:09.641587 IP 89.238.205.74.57550 > 10.33.0.55.13376: UDP, length 172
18:31:09.641597 IP 10.33.0.55.14048 > 10.1.2.112.14666: UDP, length 172
18:31:09.643672 IP 10.1.2.112.14666 > 10.33.0.55.14048: UDP, length 172
18:31:09.643683 IP 10.33.0.55.13376 > 89.238.205.74.57550: UDP, length 172
18:31:09.661391 IP 89.238.205.74.57550 > 10.33.0.55.13376: UDP, length 172
18:31:09.661402 IP 10.33.0.55.14048 > 10.1.2.112.14666: UDP, length 172
18:31:09.676900 IP 10.1.2.112.14666 > 10.33.0.55.14048: UDP, length 172
18:31:09.676911 IP 10.33.0.55.13376 > 89.238.205.74.57550: UDP, length 172
18:31:09.681375 IP 89.238.205.74.57550 > 10.33.0.55.13376: UDP, length 172
18:31:09.681387 IP 10.33.0.55.14048 > 10.1.2.112.14666: UDP, length 172
18:31:09.683713 IP 10.1.2.112.14666 > 10.33.0.55.14048: UDP, length 172
18:31:09.683724 IP 10.33.0.55.13376 > 89.238.205.74.57550: UDP, length 172
18:31:09.701428 IP 89.238.205.74.57550 > 10.33.0.55.13376: UDP, length 172
18:31:09.701439 IP 10.33.0.55.14048 > 10.1.2.112.14666: UDP, length 172
18:31:09.717026 IP 10.1.2.112.14666 > 10.33.0.55.14048: UDP, length 172
18:31:09.717055 IP 10.33.0.55.13376 > 89.238.205.74.57550: UDP, length 172
18:31:09.721507 IP 89.238.205.74.57550 > 10.33.0.55.13376: UDP, length 172
18:31:09.721522 IP 10.33.0.55.14048 > 10.1.2.112.14666: UDP, length 172
18:31:09.724452 IP 10.1.2.112.14666 > 10.33.0.55.14048: UDP, length 172
18:31:09.724463 IP 10.33.0.55.13376 > 89.238.205.74.57550: UDP, length 172
18:31:09.741517 IP 89.238.205.74.57550 > 10.33.0.55.13376: UDP, length 172
18:31:09.741529 IP 10.33.0.55.14048 > 10.1.2.112.14666: UDP, length 172
18:31:09.755155 IP 10.1.2.112.14666 > 10.33.0.55.14048: UDP, length 172
18:31:09.755167 IP 10.33.0.55.13376 > 89.238.205.74.57550: UDP, length 172
18:31:09.761314 IP 89.238.205.74.57550 > 10.33.0.55.13376: UDP, length 172
18:31:09.761325 IP 10.33.0.55.14048 > 10.1.2.112.14666: UDP, length 172
18:31:09.761829 IP 10.1.2.112.14666 > 10.33.0.55.14048: UDP, length 172
18:31:09.761839 IP 10.33.0.55.13376 > 89.238.205.74.57550: UDP, length 172
18:31:09.781401 IP 89.238.205.74.57550 > 10.33.0.55.13376: UDP, length 172
18:31:09.781416 IP 10.33.0.55.14048 > 10.1.2.112.14666: UDP, length 172
18:31:09.789110 IP 10.1.2.112.14666 > 10.33.0.55.14048: UDP, length 172
18:31:09.789125 IP 10.33.0.55.13376 > 89.238.205.74.57550: UDP, length 172
18:31:09.801578 IP 89.238.205.74.57550 > 10.33.0.55.13376: UDP, length 172
18:31:09.801604 IP 10.33.0.55.14048 > 10.1.2.112.14666: UDP, length 172
18:31:09.816952 IP 10.1.2.112.14666 > 10.33.0.55.14048: UDP, length 172
18:31:09.816982 IP 10.33.0.55.13376 > 89.238.205.74.57550: UDP, length 172
18:31:09.821870 IP 89.238.205.74.57550 > 10.33.0.55.13376: UDP, length 172
18:31:09.821885 IP 10.33.0.55.14048 > 10.1.2.112.14666: UDP, length 172
18:31:09.822393 IP 10.1.2.112.14666 > 10.33.0.55.14048: UDP, length 172
18:31:09.822404 IP 10.33.0.55.13376 > 89.238.205.74.57550: UDP, length 172
18:31:09.841473 IP 89.238.205.74.57550 > 10.33.0.55.13376: UDP, length 172
18:31:09.841499 IP 10.33.0.55.14048 > 10.1.2.112.14666: UDP, length 172
18:31:09.854909 IP 10.1.2.112.14666 > 10.33.0.55.14048: UDP, length 172
18:31:09.854925 IP 10.33.0.55.13376 > 89.238.205.74.57550: UDP, length 172
18:31:09.861421 IP 89.238.205.74.57550 > 10.33.0.55.13376: UDP, length 172
18:31:09.861455 IP 10.33.0.55.14048 > 10.1.2.112.14666: UDP, length 172
18:31:09.861571 IP 10.1.2.112.14666 > 10.33.0.55.14048: UDP, length 172
18:31:09.861585 IP 10.33.0.55.13376 > 89.238.205.74.57550: UDP, length 172
18:31:09.881382 IP 89.238.205.74.57550 > 10.33.0.55.13376: UDP, length 172
18:31:09.881401 IP 10.33.0.55.14048 > 10.1.2.112.14666: UDP, length 172
18:31:09.895615 IP 10.1.2.112.14666 > 10.33.0.55.14048: UDP, length 172
18:31:09.895630 IP 10.33.0.55.13376 > 89.238.205.74.57550: UDP, length 172
18:31:09.901385 IP 89.238.205.74.57550 > 10.33.0.55.13376: UDP, length 172
18:31:09.901410 IP 10.33.0.55.14048 > 10.1.2.112.14666: UDP, length 172
18:31:09.901788 IP 10.1.2.112.14666 > 10.33.0.55.14048: UDP, length 172
18:31:09.901799 IP 10.33.0.55.13376 > 89.238.205.74.57550: UDP, length 172
18:31:09.921355 IP 89.238.205.74.57550 > 10.33.0.55.13376: UDP, length 172
18:31:09.921378 IP 10.33.0.55.14048 > 10.1.2.112.14666: UDP, length 172
18:31:09.935271 IP 10.1.2.112.14666 > 10.33.0.55.14048: UDP, length 172
18:31:09.935294 IP 10.33.0.55.13376 > 89.238.205.74.57550: UDP, length 172
18:31:09.941570 IP 89.238.205.74.57550 > 10.33.0.55.13376: UDP, length 172
18:31:09.941584 IP 10.33.0.55.14048 > 10.1.2.112.14666: UDP, length 172
18:31:09.944703 IP 10.1.2.112.14666 > 10.33.0.55.14048: UDP, length 172
18:31:09.944714 IP 10.33.0.55.13376 > 89.238.205.74.57550: UDP, length 172
18:31:09.961443 IP 89.238.205.74.57550 > 10.33.0.55.13376: UDP, length 172
18:31:09.961456 IP 10.33.0.55.14048 > 10.1.2.112.14666: UDP, length 172
18:31:09.981386 IP 89.238.205.74.57550 > 10.33.0.55.13376: UDP, length 172
18:31:09.981408 IP 10.33.0.55.14048 > 10.1.2.112.14666: UDP, length 172
18:31:09.983374 IP 10.1.2.112.14666 > 10.33.0.55.14048: UDP, length 172
18:31:09.983392 IP 10.33.0.55.13376 > 89.238.205.74.57550: UDP, length 172
18:31:09.989827 IP 10.1.2.112.14666 > 10.33.0.55.14048: UDP, length 172
18:31:09.989844 IP 10.33.0.55.13376 > 89.238.205.74.57550: UDP, length 172
18:31:10.001471 IP 89.238.205.74.57550 > 10.33.0.55.13376: UDP, length 172
18:31:10.001488 IP 10.33.0.55.14048 > 10.1.2.112.14666: UDP, length 172
18:31:10.016635 IP 10.1.2.112.14666 > 10.33.0.55.14048: UDP, length 172
18:31:10.016647 IP 10.33.0.55.13376 > 89.238.205.74.57550: UDP, length 172
18:31:10.021552 IP 89.238.205.74.57550 > 10.33.0.55.13376: UDP, length 172
18:31:10.021565 IP 10.33.0.55.14048 > 10.1.2.112.14666: UDP, length 172
18:31:10.025265 IP 10.1.2.112.14666 > 10.33.0.55.14048: UDP, length 172
18:31:10.025276 IP 10.33.0.55.13376 > 89.238.205.74.57550: UDP, length 172
18:31:10.041395 IP 89.238.205.74.57550 > 10.33.0.55.13376: UDP, length 172
18:31:10.041407 IP 10.33.0.55.14048 > 10.1.2.112.14666: UDP, length 172
18:31:10.056652 IP 10.1.2.112.14666 > 10.33.0.55.14048: UDP, length 172
18:31:10.056664 IP 10.33.0.55.13376 > 89.238.205.74.57550: UDP, length 172
18:31:10.061349 IP 89.238.205.74.57550 > 10.33.0.55.13376: UDP, length 172
18:31:10.061360 IP 10.33.0.55.14048 > 10.1.2.112.14666: UDP, length 172
18:31:10.063434 IP 10.1.2.112.14666 > 10.33.0.55.14048: UDP, length 172
18:31:10.063445 IP 10.33.0.55.13376 > 89.238.205.74.57550: UDP, length 172
18:31:10.081486 IP 89.238.205.74.57550 > 10.33.0.55.13376: UDP, length 172
18:31:10.081500 IP 10.33.0.55.14048 > 10.1.2.112.14666: UDP, length 172
18:31:10.094933 IP 10.1.2.112.14666 > 10.33.0.55.14048: UDP, length 172
18:31:10.094958 IP 10.33.0.55.13376 > 89.238.205.74.57550: UDP, length 172
18:31:10.101502 IP 10.1.2.112.14666 > 10.33.0.55.14048: UDP, length 172
18:31:10.101517 IP 10.33.0.55.13376 > 89.238.205.74.57550: UDP, length 172
18:31:10.101541 IP 89.238.205.74.57550 > 10.33.0.55.13376: UDP, length 172
18:31:10.101559 IP 10.33.0.55.14048 > 10.1.2.112.14666: UDP, length 172
18:31:10.121545 IP 89.238.205.74.57550 > 10.33.0.55.13376: UDP, length 172
18:31:10.121556 IP 10.33.0.55.14048 > 10.1.2.112.14666: UDP, length 172
18:31:10.134986 IP 10.1.2.112.14666 > 10.33.0.55.14048: UDP, length 172
18:31:10.134998 IP 10.33.0.55.13376 > 89.238.205.74.57550: UDP, length 172
18:31:10.141488 IP 89.238.205.74.57550 > 10.33.0.55.13376: UDP, length 172
18:31:10.141499 IP 10.33.0.55.14048 > 10.1.2.112.14666: UDP, length 172
18:31:10.142094 IP 10.1.2.112.14666 > 10.33.0.55.14048: UDP, length 172
18:31:10.142105 IP 10.33.0.55.13376 > 89.238.205.74.57550: UDP, length 172
18:31:10.161485 IP 89.238.205.74.57550 > 10.33.0.55.13376: UDP, length 172
18:31:10.161497 IP 10.33.0.55.14048 > 10.1.2.112.14666: UDP, length 172
18:31:10.174821 IP 10.1.2.112.14666 > 10.33.0.55.14048: UDP, length 172
18:31:10.174833 IP 10.33.0.55.13376 > 89.238.205.74.57550: UDP, length 172
18:31:10.181620 IP 89.238.205.74.57550 > 10.33.0.55.13376: UDP, length 172
18:31:10.181634 IP 10.33.0.55.14048 > 10.1.2.112.14666: UDP, length 172
18:31:10.183042 IP 10.1.2.112.14666 > 10.33.0.55.14048: UDP, length 172
18:31:10.183053 IP 10.33.0.55.13376 > 89.238.205.74.57550: UDP, length 172
18:31:10.201560 IP 89.238.205.74.57550 > 10.33.0.55.13376: UDP, length 172
18:31:10.201572 IP 10.33.0.55.14048 > 10.1.2.112.14666: UDP, length 172
18:31:10.214494 IP 10.1.2.112.14666 > 10.33.0.55.14048: UDP, length 172
18:31:10.214543 IP 10.33.0.55.13376 > 89.238.205.74.57550: UDP, length 172
18:31:10.221746 IP 89.238.205.74.57550 > 10.33.0.55.13376: UDP, length 172
18:31:10.221767 IP 10.33.0.55.14048 > 10.1.2.112.14666: UDP, length 172
18:31:10.222399 IP 10.1.2.112.14666 > 10.33.0.55.14048: UDP, length 172
18:31:10.222411 IP 10.33.0.55.13376 > 89.238.205.74.57550: UDP, length 172
18:31:10.241526 IP 89.238.205.74.57550 > 10.33.0.55.13376: UDP, length 172
18:31:10.241542 IP 10.33.0.55.14048 > 10.1.2.112.14666: UDP, length 172
18:31:10.254699 IP 10.1.2.112.14666 > 10.33.0.55.14048: UDP, length 172
18:31:10.254737 IP 10.33.0.55.13376 > 89.238.205.74.57550: UDP, length 172
18:31:10.261643 IP 89.238.205.74.57550 > 10.33.0.55.13376: UDP, length 172
18:31:10.261658 IP 10.33.0.55.14048 > 10.1.2.112.14666: UDP, length 172
18:31:10.262048 IP 10.1.2.112.14666 > 10.33.0.55.14048: UDP, length 172
18:31:10.262059 IP 10.33.0.55.13376 > 89.238.205.74.57550: UDP, length 172
18:31:10.281574 IP 89.238.205.74.57550 > 10.33.0.55.13376: UDP, length 172
18:31:10.281589 IP 10.33.0.55.14048 > 10.1.2.112.14666: UDP, length 172
18:31:10.294371 IP 10.1.2.112.14666 > 10.33.0.55.14048: UDP, length 172
18:31:10.294386 IP 10.33.0.55.13376 > 89.238.205.74.57550: UDP, length 172
18:31:10.301480 IP 89.238.205.74.57550 > 10.33.0.55.13376: UDP, length 172
18:31:10.301492 IP 10.33.0.55.14048 > 10.1.2.112.14666: UDP, length 172
18:31:10.309424 IP 10.1.2.112.14666 > 10.33.0.55.14048: UDP, length 172
18:31:10.309436 IP 10.33.0.55.13376 > 89.238.205.74.57550: UDP, length 172
18:31:10.321465 IP 89.238.205.74.57550 > 10.33.0.55.13376: UDP, length 172
18:31:10.321477 IP 10.33.0.55.14048 > 10.1.2.112.14666: UDP, length 172
18:31:10.339673 IP 10.1.2.112.14666 > 10.33.0.55.14048: UDP, length 172
18:31:10.339692 IP 10.33.0.55.13376 > 89.238.205.74.57550: UDP, length 172
18:31:10.341543 IP 89.238.205.74.57550 > 10.33.0.55.13376: UDP, length 172
18:31:10.341554 IP 10.33.0.55.14048 > 10.1.2.112.14666: UDP, length 172
18:31:10.341796 IP 10.1.2.112.14666 > 10.33.0.55.14048: UDP, length 172
18:31:10.341807 IP 10.33.0.55.13376 > 89.238.205.74.57550: UDP, length 172
18:31:10.361725 IP 89.238.205.74.57550 > 10.33.0.55.13376: UDP, length 172
18:31:10.361748 IP 10.33.0.55.14048 > 10.1.2.112.14666: UDP, length 172
18:31:10.374471 IP 10.1.2.112.14666 > 10.33.0.55.14048: UDP, length 172
18:31:10.374486 IP 10.33.0.55.13376 > 89.238.205.74.57550: UDP, length 172
18:31:10.381473 IP 89.238.205.74.57550 > 10.33.0.55.13376: UDP, length 172
18:31:10.381487 IP 10.33.0.55.14048 > 10.1.2.112.14666: UDP, length 172
18:31:10.381566 IP 10.1.2.112.14666 > 10.33.0.55.14048: UDP, length 172
18:31:10.381574 IP 10.33.0.55.13376 > 89.238.205.74.57550: UDP, length 172
18:31:10.401627 IP 89.238.205.74.57550 > 10.33.0.55.13376: UDP, length 172
18:31:10.401639 IP 10.33.0.55.14048 > 10.1.2.112.14666: UDP, length 172
18:31:10.421531 IP 89.238.205.74.57550 > 10.33.0.55.13376: UDP, length 172
18:31:10.421917 IP 10.1.2.112.14666 > 10.33.0.55.14048: UDP, length 172
18:31:10.422296 IP 10.1.2.112.14666 > 10.33.0.55.14048: UDP, length 172
18:31:10.423275 IP 10.33.0.55.13376 > 89.238.205.74.57550: UDP, length 172
18:31:10.423286 IP 10.33.0.55.14048 > 10.1.2.112.14666: UDP, length 172
18:31:10.423292 IP 10.33.0.55.13376 > 89.238.205.74.57550: UDP, length 172
18:31:10.441464 IP 89.238.205.74.57550 > 10.33.0.55.13376: UDP, length 172
18:31:10.441484 IP 10.33.0.55.14048 > 10.1.2.112.14666: UDP, length 172
18:31:10.461410 IP 89.238.205.74.57550 > 10.33.0.55.13376: UDP, length 172
18:31:10.461437 IP 10.33.0.55.14048 > 10.1.2.112.14666: UDP, length 172
18:31:10.462994 IP 10.1.2.112.14666 > 10.33.0.55.14048: UDP, length 172
18:31:10.463010 IP 10.33.0.55.13376 > 89.238.205.74.57550: UDP, length 172
18:31:10.470599 IP 10.1.2.112.14666 > 10.33.0.55.14048: UDP, length 172
18:31:10.470614 IP 10.33.0.55.13376 > 89.238.205.74.57550: UDP, length 172
18:31:10.481501 IP 89.238.205.74.57550 > 10.33.0.55.13376: UDP, length 172
18:31:10.481517 IP 10.33.0.55.14048 > 10.1.2.112.14666: UDP, length 172
18:31:10.495217 IP 10.1.2.112.14666 > 10.33.0.55.14048: UDP, length 172
18:31:10.495232 IP 10.33.0.55.13376 > 89.238.205.74.57550: UDP, length 172
18:31:10.501347 IP 10.1.2.112.14666 > 10.33.0.55.14048: UDP, length 172
18:31:10.501361 IP 10.33.0.55.13376 > 89.238.205.74.57550: UDP, length 172
18:31:10.501487 IP 89.238.205.74.57550 > 10.33.0.55.13376: UDP, length 172
18:31:10.501501 IP 10.33.0.55.14048 > 10.1.2.112.14666: UDP, length 172
18:31:10.521746 IP 89.238.205.74.57550 > 10.33.0.55.13376: UDP, length 172
18:31:10.521761 IP 10.33.0.55.14048 > 10.1.2.112.14666: UDP, length 172
18:31:10.534679 IP 10.1.2.112.14666 > 10.33.0.55.14048: UDP, length 172
18:31:10.534694 IP 10.33.0.55.13376 > 89.238.205.74.57550: UDP, length 172
18:31:10.541630 IP 89.238.205.74.57550 > 10.33.0.55.13376: UDP, length 172
18:31:10.541644 IP 10.33.0.55.14048 > 10.1.2.112.14666: UDP, length 172
18:31:10.541768 IP 10.1.2.112.14666 > 10.33.0.55.14048: UDP, length 172
18:31:10.541785 IP 10.33.0.55.13376 > 89.238.205.74.57550: UDP, length 172
18:31:10.561589 IP 89.238.205.74.57550 > 10.33.0.55.13376: UDP, length 172
18:31:10.561604 IP 10.33.0.55.14048 > 10.1.2.112.14666: UDP, length 172
18:31:10.574611 IP 10.1.2.112.14666 > 10.33.0.55.14048: UDP, length 172
18:31:10.574626 IP 10.33.0.55.13376 > 89.238.205.74.57550: UDP, length 172
18:31:10.581279 IP 10.1.2.112.14666 > 10.33.0.55.14048: UDP, length 172
18:31:10.581294 IP 10.33.0.55.13376 > 89.238.205.74.57550: UDP, length 172
18:31:10.581538 IP 89.238.205.74.57550 > 10.33.0.55.13376: UDP, length 172
18:31:10.581553 IP 10.33.0.55.14048 > 10.1.2.112.14666: UDP, length 172
18:31:10.601610 IP 89.238.205.74.57550 > 10.33.0.55.13376: UDP, length 172
18:31:10.601625 IP 10.33.0.55.14048 > 10.1.2.112.14666: UDP, length 172
18:31:10.614882 IP 10.1.2.112.14666 > 10.33.0.55.14048: UDP, length 172
18:31:10.614897 IP 10.33.0.55.13376 > 89.238.205.74.57550: UDP, length 172
18:31:10.621542 IP 89.238.205.74.57550 > 10.33.0.55.13376: UDP, length 172
18:31:10.621556 IP 10.33.0.55.14048 > 10.1.2.112.14666: UDP, length 172
18:31:10.621649 IP 10.1.2.112.14666 > 10.33.0.55.14048: UDP, length 172
18:31:10.621663 IP 10.33.0.55.13376 > 89.238.205.74.57550: UDP, length 172
18:31:10.641612 IP 89.238.205.74.57550 > 10.33.0.55.13376: UDP, length 172
18:31:10.641654 IP 10.33.0.55.14048 > 10.1.2.112.14666: UDP, length 172
18:31:10.654861 IP 10.1.2.112.14666 > 10.33.0.55.14048: UDP, length 172
18:31:10.654875 IP 10.33.0.55.13376 > 89.238.205.74.57550: UDP, length 172
18:31:10.661591 IP 89.238.205.74.57550 > 10.33.0.55.13376: UDP, length 172
18:31:10.661605 IP 10.33.0.55.14048 > 10.1.2.112.14666: UDP, length 172
18:31:10.661777 IP 10.1.2.112.14666 > 10.33.0.55.14048: UDP, length 172
18:31:10.661791 IP 10.33.0.55.13376 > 89.238.205.74.57550: UDP, length 172
18:31:10.681477 IP 89.238.205.74.57550 > 10.33.0.55.13376: UDP, length 172
18:31:10.681492 IP 10.33.0.55.14048 > 10.1.2.112.14666: UDP, length 172
18:31:10.701539 IP 89.238.205.74.57550 > 10.33.0.55.13376: UDP, length 172
18:31:10.701564 IP 10.33.0.55.14048 > 10.1.2.112.14666: UDP, length 172
18:31:10.721679 IP 89.238.205.74.57550 > 10.33.0.55.13376: UDP, length 172
18:31:10.721697 IP 10.33.0.55.14048 > 10.1.2.112.14666: UDP, length 172
18:31:10.741540 IP 89.238.205.74.57550 > 10.33.0.55.13376: UDP, length 172
18:31:10.741555 IP 10.33.0.55.14048 > 10.1.2.112.14666: UDP, length 172
18:31:10.761443 IP 89.238.205.74.57550 > 10.33.0.55.13376: UDP, length 172
18:31:10.761457 IP 10.33.0.55.14048 > 10.1.2.112.14666: UDP, length 172
18:31:10.781714 IP 89.238.205.74.57550 > 10.33.0.55.13376: UDP, length 172
18:31:10.781729 IP 10.33.0.55.14048 > 10.1.2.112.14666: UDP, length 172
18:31:10.801683 IP 89.238.205.74.57550 > 10.33.0.55.13376: UDP, length 172
18:31:10.801697 IP 10.33.0.55.14048 > 10.1.2.112.14666: UDP, length 172
18:31:10.821794 IP 89.238.205.74.57550 > 10.33.0.55.13376: UDP, length 172
18:31:10.821815 IP 10.33.0.55.14048 > 10.1.2.112.14666: UDP, length 172
18:31:10.831017 IP 10.1.2.112.14666 > 10.33.0.55.14048: UDP, length 172
18:31:10.831018 IP 10.1.2.112.14666 > 10.33.0.55.14048: UDP, length 172
18:31:10.831038 IP 10.33.0.55.13376 > 89.238.205.74.57550: UDP, length 172
18:31:10.831044 IP 10.33.0.55.13376 > 89.238.205.74.57550: UDP, length 172
18:31:10.841555 IP 89.238.205.74.57550 > 10.33.0.55.13376: UDP, length 172
